2022, Julho, As It Was, Harry Styles, https://open.spotify.com/track/6Z3fsQfKc6c2qzXZ5Z5Z5Z
2022, Agosto, Break My Soul, Beyoncé, https://open.spotify.com/track/6Z3fsQfKc6c2qzXZ5Z5Z5Z
2022, Setembro, Super Freaky Girl, Nicki Minaj, https://open.spotify.com/track/6Z3fsQfKc6c2qzXZ5Z5Z5Z
2022, Outubro, Unholy, Sam Smith & Kim Petras, https://open.spotify.com/track/6Z3fsQfKc6c2qzXZ5Z5Z5Z
2022, Novembro, Anti-Hero, Taylor Swift, https://open.spotify.com/track/6Z3fsQfKc6c2qzXZ5Z5Z5Z
2022, Dezembro, All I Want for Christmas Is You, Mariah Carey, https://open.spotify.com/track/6Z3fsQfKc6c2qzXZ5Z5Z5Z
2023, Janeiro, Flowers, Miley Cyrus, https://open.spotify.com/track/6Z3fsQfKc6c2qzXZ5Z5Z5Z
2023, Fevereiro, Flowers, Miley Cyrus, https://open.spotify.com/track/6Z3fsQfKc6c2qzXZ5Z5Z5Z
2023, Março, Flowers, Miley Cyrus, https://open.spotify.com/track/6Z3fsQfKc6c2qzXZ5Z5Z5Z
2023, Abril, Last Night, Morgan Wallen, https://open.spotify.com/track/6Z3fsQfKc6c2qzXZ5Z5Z5Z
2023, Maio, Last Night, Morgan Wallen, https://open.spotify.com/track/6Z3fsQfKc6c2qzXZ5Z5Z5Z
2023, Junho, Last Night, Morgan Wallen, https://open.spotify.com/track/6Z3fsQfKc6c2qzXZ5Z5Z5Z
2023, Julho, Vampire, Olivia Rodrigo, https://open.spotify.com/track/6Z3fsQfKc6c2qzXZ5Z5Z5Z
2023, Agosto, Paint the Town Red, Doja Cat, https://open.spotify.com/track/6Z3fsQfKc6c2qzXZ5Z5Z5Z
2023, Setembro, Paint the Town Red, Doja Cat, https://open.spotify.com/track/6Z3fsQfKc6c2qzXZ5Z5Z5Z
2023, Outubro, Paint the Town Red, Doja Cat, https://open.spotify.com/track/6Z3fsQfKc6c2qzXZ5Z5Z5Z
2023, Novembro, N/A, N/A, N/A
2023, Dezembro, N/A, N/A, N/A
