Ano, Mês, Musica, Artista, Link
1960, Janeiro, El Paso, Marty Robbins, https://open.spotify.com/track/4f8hBeMXMvssn6HtFAtblo
1960, Fevereiro, Teen Angel, Mark Dinning, https://open.spotify.com/track/4gZi2M0a7K1W7DXhP0o3l1
1960, Março, Theme from 'A Summer Place', Percy Faith & His Orchestra, https://open.spotify.com/track/6zwvB879PJSpTyFcg2wwnL
1960, Abril, Theme from 'A Summer Place', Percy Faith & His Orchestra, https://open.spotify.com/track/6zwvB879PJSpTyFcg2wwnL
1960, Maio, Stuck on You, Elvis Presley, https://open.spotify.com/track/6HPLeKiNm92RbykX2BDTUB
1960, Junho, Cathy's Clown, The Everly Brothers, https://open.spotify.com/intl-pt/track/1MA9StLzlFftLbuqOmoWij?si=19c9da8e0a384202
1960, Julho, Everybody's Somebody's Fool, Connie Francis, https://open.spotify.com/track/3FdZ5L5cEBC3C6y5l2YFQx
1960, Agosto, It's Now or Never, Elvis Presley, https://open.spotify.com/track/1wPNlV8bXf2j6XkVZ7p3tK
1960, Setembro, The Twist, Chubby Checker, https://open.spotify.com/track/4LvwDZ4ZaWZv3tJ7k7jSRI
1960, Outubro, Mr. Custer, Larry Verne, https://open.spotify.com/track/5Z7y7k7U4bE7zqZ5Z5z5Z5
1960, Novembro, Georgia on My Mind, Ray Charles, https://open.spotify.com/track/6Z3fsQfKc6c2qzXZ5Z5Z5Z
1960, Dezembro, Stay, Maurice Williams & The Zodiacs, https://open.spotify.com/track/6Z3fsQfKc6c2qzXZ5Z5Z5Z
1961, Janeiro, Wonderland by Night, Bert Kaempfert & His Orchestra, https://open.spotify.com/track/6Z3fsQfKc6c2qzXZ5Z5Z5Z
1961, Fevereiro, Calcutta, Lawrence Welk & His Orchestra, https://open.spotify.com/track/6Z3fsQfKc6c2qzXZ5Z5Z5Z
1961, Março, Pony Time, Chubby Checker, https://open.spotify.com/track/6Z3fsQfKc6c2qzXZ5Z5Z5Z
1961, Abril, Blue Moon, The Marcels, https://open.spotify.com/track/6Z3fsQfKc6c2qzXZ5Z5Z5Z
1961, Maio, Runaway, Del Shannon, https://open.spotify.com/track/6Z3fsQfKc6c2qzXZ5Z5Z5Z
1961, Junho, Travelin' Man, Ricky Nelson, https://open.spotify.com/track/6Z3fsQfKc6c2qzXZ5Z5Z5Z
1961, Julho, Tossin' and Turnin', Bobby Lewis, https://open.spotify.com/track/6Z3fsQfKc6c2qzXZ5Z5Z5Z
1961, Agosto, Quarter to Three, Gary U.S. Bonds, https://open.spotify.com/track/6Z3fsQfKc6c2qzXZ5Z5Z5Z
1961, Setembro, Michael, The Highwaymen, https://open.spotify.com/track/6Z3fsQfKc6c2qzXZ5Z5Z5Z
1961, Outubro, Take Good Care of My Baby, Bobby Vee, https://open.spotify.com/track/6Z3fsQfKc6c2qzXZ5Z5Z5Z
1961, Novembro, Big Bad John, Jimmy Dean, https://open.spotify.com/track/6Z3fsQfKc6c2qzXZ5Z5Z5Z
1961, Dezembro, The Lion Sleeps Tonight, The Tokens, https://open.spotify.com/track/6Z3fsQfKc6c2qzXZ5Z5Z5Z
1962, Janeiro, The Twist, Chubby Checker, https://open.spotify.com/track/4LvwDZ4ZaWZv3tJ7k7jSRI
1962, Fevereiro, Peppermint Twist - Part 1, Joey Dee & The Starliters, https://open.spotify.com/track/6Z3fsQfKc6c2qzXZ5Z5Z5Z
1962, Março, Hey! Baby, Bruce Channel, https://open.spotify.com/track/6Z3fsQfKc6c2qzXZ5Z5Z5Z
1962, Abril, Johnny Angel, Shelley Fabares, https://open.spotify.com/track/6Z3fsQfKc6c2qzXZ5Z5Z5Z
1962, Maio, Soldier Boy, The Shirelles, https://open.spotify.com/track/6Z3fsQfKc6c2qzXZ5Z5Z5Z
1962, Junho, I Can't Stop Loving You, Ray Charles, https://open.spotify.com/track/6Z3fsQfKc6c2qzXZ5Z5Z5Z
1962, Julho, Roses Are Red (My Love), Bobby Vinton, https://open.spotify.com/track/6Z3fsQfKc6c2qzXZ5Z5Z5Z
1962, Agosto, Breaking Up Is Hard to Do, Neil Sedaka, https://open.spotify.com/track/6Z3fsQfKc6c2qzXZ5Z5Z5Z
1962, Setembro, Sherry, The Four Seasons, https://open.spotify.com/track/6Z3fsQfKc6c2qzXZ5Z5Z5Z
1962, Outubro, Monster Mash, Bobby Boris Pickett & The Crypt-Kickers, https://open.spotify.com/track/6Z3fsQfKc6c2qzXZ5Z5Z5Z
1962, Novembro, He's a Rebel, The Crystals, https://open.spotify.com/track/6Z3fsQfKc6c2qzXZ5Z5Z5Z
1962, Dezembro, Telstar, The Tornados, https://open.spotify.com/track/6Z3fsQfKc6c2qzXZ5Z5Z5Z
1963, Janeiro, Go Away Little Girl, Steve Lawrence, https://open.spotify.com/track/6Z3fsQfKc6c2qzXZ5Z5Z5Z
1963, Fevereiro, Walk Like a Man, The Four Seasons, https://open.spotify.com/track/6Z3fsQfKc6c2qzXZ5Z5Z5Z
1963, Março, Our Day Will Come, Ruby & The Romantics, https://open.spotify.com/track/6Z3fsQfKc6c2qzXZ5Z5Z5Z
1963, Abril, He's So Fine, The Chiffons, https://open.spotify.com/track/6Z3fsQfKc6c2qzXZ5Z5Z5Z
1963, Maio, I Will Follow Him, Little Peggy March, https://open.spotify.com/track/6Z3fsQfKc6c2qzXZ5Z5Z5Z
1963, Junho, It's My Party, Lesley Gore, https://open.spotify.com/track/6Z3fsQfKc6c2qzXZ5Z5Z5Z
1963, Julho, Sukiyaki, Kyu Sakamoto, https://open.spotify.com/track/6Z3fsQfKc6c2qzXZ5Z5Z5Z
1963, Agosto, Fingertips - Pt 2, Little Stevie Wonder, https://open.spotify.com/track/6Z3fsQfKc6c2qzXZ5Z5Z5Z
1963, Setembro, My Boyfriend's Back, The Angels, https://open.spotify.com/track/6Z3fsQfKc6c2qzXZ5Z5Z5Z
1963, Outubro, Sugar Shack, Jimmy Gilmer & The Fireballs, https://open.spotify.com/track/6Z3fsQfKc6c2qzXZ5Z5Z5Z
1963, Novembro, Deep Purple, Nino Tempo & April Stevens, https://open.spotify.com/track/6Z3fsQfKc6c2qzXZ5Z5Z5Z
1963, Dezembro, Dominique, The Singing Nun, https://open.spotify.com/track/6Z3fsQfKc6c2qzXZ5Z5Z5Z
1964, Janeiro, There! I've Said It Again, Bobby Vinton, https://open.spotify.com/track/6Z3fsQfKc6c2qzXZ5Z5Z5Z
1964, Fevereiro, I Want to Hold Your Hand, The Beatles, https://open.spotify.com/track/6Z3fsQfKc6c2qzXZ5Z5Z5Z
1964, Março, She Loves You, The Beatles, https://open.spotify.com/track/6Z3fsQfKc6c2qzXZ5Z5Z5Z
1964, Abril, Can't Buy Me Love, The Beatles, https://open.spotify.com/track/6Z3fsQfKc6c2qzXZ5Z5Z5Z
1964, Maio, Hello Dolly!, Louis Armstrong, https://open.spotify.com/track/6Z3fsQfKc6c2qzXZ5Z5Z5Z
1964, Junho, My Guy, Mary Wells, https://open.spotify.com/track/6Z3fsQfKc6c2qzXZ5Z5Z5Z
1964, Julho, A World Without Love, Peter & Gordon, https://open.spotify.com/track/6Z3fsQfKc6c2qzXZ5Z5Z5Z
1964, Agosto, Rag Doll, The Four Seasons, https://open.spotify.com/track/6Z3fsQfKc6c2qzXZ5Z5Z5Z
1964, Setembro, The House of the Rising Sun, The Animals, https://open.spotify.com/track/6Z3fsQfKc6c2qzXZ5Z5Z5Z
1964, Outubro, Oh Pretty Woman, Roy Orbison, https://open.spotify.com/track/6Z3fsQfKc6c2qzXZ5Z5Z5Z
1964, Novembro, Baby Love, The Supremes, https://open.spotify.com/track/6Z3fsQfKc6c2qzXZ5Z5Z5Z
1964, Dezembro, Ringo, Lorne Greene, https://open.spotify.com/track/6Z3fsQfKc6c2qzXZ5Z5Z5Z
1965, Janeiro, Come See About Me, The Supremes, https://open.spotify.com/track/6Z3fsQfKc6c2qzXZ5Z5Z5Z
1965, Fevereiro, You've Lost That Lovin' Feelin', The Righteous Brothers, https://open.spotify.com/track/6Z3fsQfKc6c2qzXZ5Z5Z5Z
1965, Março, This Diamond Ring, Gary Lewis & The Playboys, https://open.spotify.com/track/6Z3fsQfKc6c2qzXZ5Z5Z5Z
1965, Abril, Stop! In the Name of Love, The Supremes, https://open.spotify.com/track/6Z3fsQfKc6c2qzXZ5Z5Z5Z
1965, Maio, Help Me Rhonda, The Beach Boys, https://open.spotify.com/track/6Z3fsQfKc6c2qzXZ5Z5Z5Z
1965, Junho, Back in My Arms Again, The Supremes, https://open.spotify.com/track/6Z3fsQfKc6c2qzXZ5Z5Z5Z
1965, Julho, I Can't Help Myself (Sugar Pie Honey Bunch), The Four Tops, https://open.spotify.com/track/6Z3fsQfKc6c2qzXZ5Z5Z5Z
1965, Agosto, (I Can't Get No) Satisfaction, The Rolling Stones, https://open.spotify.com/track/6Z3fsQfKc6c2qzXZ5Z5Z5Z
1965, Setembro, Help!, The Beatles, https://open.spotify.com/track/6Z3fsQfKc6c2qzXZ5Z5Z5Z
1965, Outubro, Yesterday, The Beatles, https://open.spotify.com/track/6Z3fsQfKc6c2qzXZ5Z5Z5Z
1965, Novembro, Get Off of My Cloud, The Rolling Stones, https://open.spotify.com/track/6Z3fsQfKc6c2qzXZ5Z5Z5Z
1965, Dezembro, Turn! Turn! Turn! (To Everything There Is a Season), The Byrds, https://open.spotify.com/track/6Z3fsQfKc6c2qzXZ5Z5Z5Z
1966, Janeiro, The Sound of Silence, Simon & Garfunkel, https://open.spotify.com/track/6Z3fsQfKc6c2qzXZ5Z5Z5Z
1966, Fevereiro, Lightnin' Strikes, Lou Christie, https://open.spotify.com/track/6Z3fsQfKc6c2qzXZ5Z5Z5Z
1966, Março, Ballad of the Green Berets, SSgt Barry Sadler, https://open.spotify.com/track/6Z3fsQfKc6c2qzXZ5Z5Z5Z
1966, Abril, (You're My) Soul and Inspiration, The Righteous Brothers, https://open.spotify.com/track/6Z3fsQfKc6c2qzXZ5Z5Z5Z
1966, Maio, Monday  Monday, The Mamas & The Papas, https://open.spotify.com/track/6Z3fsQfKc6c2qzXZ5Z5Z5Z
1966, Junho, Paint It Black, The Rolling Stones, https://open.spotify.com/track/6Z3fsQfKc6c2qzXZ5Z5Z5Z
1966, Julho, Strangers in the Night, Frank Sinatra, https://open.spotify.com/track/6Z3fsQfKc6c2qzXZ5Z5Z5Z
1966, Agosto, Wild Thing, The Troggs, https://open.spotify.com/track/6Z3fsQfKc6c2qzXZ5Z5Z5Z
1966, Setembro, Summer in the City, The Lovin' Spoonful, https://open.spotify.com/track/6Z3fsQfKc6c2qzXZ5Z5Z5Z
1966, Outubro, You Can't Hurry Love, The Supremes, https://open.spotify.com/track/6Z3fsQfKc6c2qzXZ5Z5Z5Z
1966, Novembro, Reach Out I'll Be There, The Four Tops, https://open.spotify.com/track/6Z3fsQfKc6c2qzXZ5Z5Z5Z
1966, Dezembro, Good Vibrations, The Beach Boys, https://open.spotify.com/track/6Z3fsQfKc6c2qzXZ5Z5Z5Z
1967, Janeiro, I'm a Believer, The Monkees, https://open.spotify.com/track/6Z3fsQfKc6c2qzXZ5Z5Z5Z
1967, Fevereiro, Kind of a Drag, The Buckinghams, https://open.spotify.com/track/6Z3fsQfKc6c2qzXZ5Z5Z5Z
1967, Março, Ruby Tuesday, The Rolling Stones, https://open.spotify.com/track/6Z3fsQfKc6c2qzXZ5Z5Z5Z
1967, Abril, Somethin' Stupid, Frank & Nancy Sinatra, https://open.spotify.com/track/6Z3fsQfKc6c2qzXZ5Z5Z5Z
1967, Maio, The Happening, The Supremes, https://open.spotify.com/track/6Z3fsQfKc6c2qzXZ5Z5Z5Z
1967, Junho, Respect, Aretha Franklin, https://open.spotify.com/track/6Z3fsQfKc6c2qzXZ5Z5Z5Z
1967, Julho, Windy, The Association, https://open.spotify.com/track/6Z3fsQfKc6c2qzXZ5Z5Z5Z
1967, Agosto, Light My Fire, The Doors, https://open.spotify.com/track/6Z3fsQfKc6c2qzXZ5Z5Z5Z
1967, Setembro, Ode to Billie Joe, Bobbie Gentry, https://open.spotify.com/track/6Z3fsQfKc6c2qzXZ5Z5Z5Z
1967, Outubro, To Sir with Love, Lulu, https://open.spotify.com/track/6Z3fsQfKc6c2qzXZ5Z5Z5Z
1967, Novembro, Incense and Peppermints, Strawberry Alarm Clock, https://open.spotify.com/track/6Z3fsQfKc6c2qzXZ5Z5Z5Z
1967, Dezembro, Hello Goodbye, The Beatles, https://open.spotify.com/track/6Z3fsQfKc6c2qzXZ5Z5Z5Z
1968, Janeiro, Judy in Disguise (With Glasses), John Fred & His Playboy Band, https://open.spotify.com/track/6Z3fsQfKc6c2qzXZ5Z5Z5Z
1968, Fevereiro, Love Is Blue, Paul Mauriat & His Orchestra, https://open.spotify.com/track/6Z3fsQfKc6c2qzXZ5Z5Z5Z
1968, Março, Dock of the Bay, Otis Redding, https://open.spotify.com/track/6Z3fsQfKc6c2qzXZ5Z5Z5Z
1968, Abril, Honey, Bobby Goldsboro, https://open.spotify.com/track/6Z3fsQfKc6c2qzXZ5Z5Z5Z
1968, Maio, Tighten Up, Archie Bell & The Drells, https://open.spotify.com/track/6Z3fsQfKc6c2qzXZ5Z5Z5Z
1968, Junho, Mrs. Robinson, Simon & Garfunkel, https://open.spotify.com/track/6Z3fsQfKc6c2qzXZ5Z5Z5Z
1968, Julho, This Guy's in Love with You, Herb Alpert, https://open.spotify.com/track/6Z3fsQfKc6c2qzXZ5Z5Z5Z
1968, Agosto, Hello I Love You, The Doors, https://open.spotify.com/track/6Z3fsQfKc6c2qzXZ5Z5Z5Z
1968, Setembro, Harper Valley P.T.A., Jeannie C. Riley, https://open.spotify.com/track/6Z3fsQfKc6c2qzXZ5Z5Z5Z
1968, Outubro, Hey Jude, The Beatles, https://open.spotify.com/track/6Z3fsQfKc6c2qzXZ5Z5Z5Z
1968, Novembro, Love Child, The Supremes, https://open.spotify.com/track/6Z3fsQfKc6c2qzXZ5Z5Z5Z
1968, Dezembro, I Heard It Through the Grapevine, Marvin Gaye, https://open.spotify.com/track/6Z3fsQfKc6c2qzXZ5Z5Z5Z
1969, Janeiro, I Heard It Through the Grapevine, Marvin Gaye, https://open.spotify.com/track/6Z3fsQfKc6c2qzXZ5Z5Z5Z
1969, Fevereiro, Crimson and Clover, Tommy James & The Shondells, https://open.spotify.com/track/6Z3fsQfKc6c2qzXZ5Z5Z5Z
1969, Março, Everyday People, Sly & The Family Stone, https://open.spotify.com/track/6Z3fsQfKc6c2qzXZ5Z5Z5Z
1969, Abril, Aquarius/Let the Sunshine In, The 5th Dimension, https://open.spotify.com/track/6Z3fsQfKc6c2qzXZ5Z5Z5Z
1969, Maio, Get Back, The Beatles, https://open.spotify.com/track/6Z3fsQfKc6c2qzXZ5Z5Z5Z
1969, Junho, Love Theme from 'Romeo and Juliet', Henry Mancini, https://open.spotify.com/track/6Z3fsQfKc6c2qzXZ5Z5Z5Z
1969, Julho, In the Year 2525 (Exordium & Terminus), Zager & Evans, https://open.spotify.com/track/6Z3fsQfKc6c2qzXZ5Z5Z5Z
1969, Agosto, Honky Tonk Women, The Rolling Stones, https://open.spotify.com/track/6Z3fsQfKc6c2qzXZ5Z5Z5Z
1969, Setembro, Sugar Sugar, The Archies, https://open.spotify.com/track/6Z3fsQfKc6c2qzXZ5Z5Z5Z
1969, Outubro, I Can't Get Next to You, The Temptations, https://open.spotify.com/track/6Z3fsQfKc6c2qzXZ5Z5Z5Z
1969, Novembro, Suspicious Minds, Elvis Presley, https://open.spotify.com/track/6Z3fsQfKc6c2qzXZ5Z5Z5Z
1969, Dezembro, Na Na Hey Hey Kiss Him Goodbye, Steam, https://open.spotify.com/track/6Z3fsQfKc6c2qzXZ5Z5Z5Z
1970, Janeiro, Raindrops Keep Fallin' on My Head, B.J. Thomas, https://open.spotify.com/track/6Z3fsQfKc6c2qzXZ5Z5Z5Z
1970, Fevereiro, I Want You Back, The Jackson 5, https://open.spotify.com/track/6Z3fsQfKc6c2qzXZ5Z5Z5Z
1970, Março, Bridge Over Troubled Water, Simon & Garfunkel, https://open.spotify.com/track/6Z3fsQfKc6c2qzXZ5Z5Z5Z
1970, Abril, Let It Be, The Beatles, https://open.spotify.com/track/6Z3fsQfKc6c2qzXZ5Z5Z5Z
1970, Maio, American Woman, The Guess Who, https://open.spotify.com/track/6Z3fsQfKc6c2qzXZ5Z5Z5Z
1970, Junho, Everything Is Beautiful, Ray Stevens, https://open.spotify.com/track/6Z3fsQfKc6c2qzXZ5Z5Z5Z
1970, Julho, The Long and Winding Road, The Beatles, https://open.spotify.com/track/6Z3fsQfKc6c2qzXZ5Z5Z5Z
1970, Agosto, (They Long to Be) Close to You, The Carpenters, https://open.spotify.com/track/6Z3fsQfKc6c2qzXZ5Z5Z5Z
1970, Setembro, Make It with You, Bread, https://open.spotify.com/track/6Z3fsQfKc6c2qzXZ5Z5Z5Z
1970, Outubro, War, Edwin Starr, https://open.spotify.com/track/6Z3fsQfKc6c2qzXZ5Z5Z5Z
1970, Novembro, I'll Be There, The Jackson 5, https://open.spotify.com/track/6Z3fsQfKc6c2qzXZ5Z5Z5Z
1970, Dezembro, My Sweet Lord, George Harrison, https://open.spotify.com/track/6Z3fsQfKc6c2qzXZ5Z5Z5Z
1971, Janeiro, My Sweet Lord, George Harrison, https://open.spotify.com/track/6Z3fsQfKc6c2qzXZ5Z5Z5Z
1971, Fevereiro, One Bad Apple, The Osmonds, https://open.spotify.com/track/6Z3fsQfKc6c2qzXZ5Z5Z5Z
1971, Março, Knock Three Times, Dawn, https://open.spotify.com/track/6Z3fsQfKc6c2qzXZ5Z5Z5Z
1971, Abril, Joy to the World, Three Dog Night, https://open.spotify.com/track/6Z3fsQfKc6c2qzXZ5Z5Z5Z
1971, Maio, Brown Sugar, The Rolling Stones, https://open.spotify.com/track/6Z3fsQfKc6c2qzXZ5Z5Z5Z
1971, Junho, Want Ads, The Honey Cone, https://open.spotify.com/track/6Z3fsQfKc6c2qzXZ5Z5Z5Z
1971, Julho, It's Too Late, Carole King, https://open.spotify.com/track/6Z3fsQfKc6c2qzXZ5Z5Z5Z
1971, Agosto, How Can You Mend a Broken Heart, Bee Gees, https://open.spotify.com/track/6Z3fsQfKc6c2qzXZ5Z5Z5Z
1971, Setembro, Go Away Little Girl, Donny Osmond, https://open.spotify.com/track/6Z3fsQfKc6c2qzXZ5Z5Z5Z
1971, Outubro, Maggie May, Rod Stewart, https://open.spotify.com/track/6Z3fsQfKc6c2qzXZ5Z5Z5Z
1971, Novembro, Gypsys Tramps & Thieves, Cher, https://open.spotify.com/track/6Z3fsQfKc6c2qzXZ5Z5Z5Z
1971, Dezembro, Brand New Key, Melanie, https://open.spotify.com/track/6Z3fsQfKc6c2qzXZ5Z5Z5Z
1972, Janeiro, American Pie, Don McLean, https://open.spotify.com/track/6Z3fsQfKc6c2qzXZ5Z5Z5Z
1972, Fevereiro, Without You, Nilsson, https://open.spotify.com/track/6Z3fsQfKc6c2qzXZ5Z5Z5Z
1972, Março, Heart of Gold, Neil Young, https://open.spotify.com/track/6Z3fsQfKc6c2qzXZ5Z5Z5Z
1972, Abril, The First Time Ever I Saw Your Face, Roberta Flack, https://open.spotify.com/track/6Z3fsQfKc6c2qzXZ5Z5Z5Z
1972, Maio, Oh Girl, The Chi-Lites, https://open.spotify.com/track/6Z3fsQfKc6c2qzXZ5Z5Z5Z
1972, Junho, I'll Take You There, The Staple Singers, https://open.spotify.com/track/6Z3fsQfKc6c2qzXZ5Z5Z5Z
1972, Julho, Lean on Me, Bill Withers, https://open.spotify.com/track/6Z3fsQfKc6c2qzXZ5Z5Z5Z
1972, Agosto, Alone Again (Naturally), Gilbert O'Sullivan, https://open.spotify.com/track/6Z3fsQfKc6c2qzXZ5Z5Z5Z
1972, Setembro, Brandy (You're a Fine Girl), Looking Glass, https://open.spotify.com/track/6Z3fsQfKc6c2qzXZ5Z5Z5Z
1972, Outubro, My Ding-a-Ling, Chuck Berry, https://open.spotify.com/track/6Z3fsQfKc6c2qzXZ5Z5Z5Z
1972, Novembro, I Can See Clearly Now, Johnny Nash, https://open.spotify.com/track/6Z3fsQfKc6c2qzXZ5Z5Z5Z
1972, Dezembro, Papa Was a Rollin' Stone, The Temptations, https://open.spotify.com/track/6Z3fsQfKc6c2qzXZ5Z5Z5Z
1973, Janeiro, You're So Vain, Carly Simon, https://open.spotify.com/track/6Z3fsQfKc6c2qzXZ5Z5Z5Z
1973, Fevereiro, Crocodile Rock, Elton John, https://open.spotify.com/track/6Z3fsQfKc6c2qzXZ5Z5Z5Z
1973, Março, Killing Me Softly with His Song, Roberta Flack, https://open.spotify.com/track/6Z3fsQfKc6c2qzXZ5Z5Z5Z
1973, Abril, Tie a Yellow Ribbon Round the Ole Oak Tree, Tony Orlando & Dawn, https://open.spotify.com/track/6Z3fsQfKc6c2qzXZ5Z5Z5Z
1973, Maio, You Are the Sunshine of My Life, Stevie Wonder, https://open.spotify.com/track/6Z3fsQfKc6c2qzXZ5Z5Z5Z
1973, Junho, My Love, Paul McCartney & Wings, https://open.spotify.com/track/6Z3fsQfKc6c2qzXZ5Z5Z5Z
1973, Julho, Give Me Love (Give Me Peace on Earth), George Harrison, https://open.spotify.com/track/6Z3fsQfKc6c2qzXZ5Z5Z5Z
1973, Agosto, The Morning After, Maureen McGovern, https://open.spotify.com/track/6Z3fsQfKc6c2qzXZ5Z5Z5Z
1973, Setembro, Delta Dawn, Helen Reddy, https://open.spotify.com/track/6Z3fsQfKc6c2qzXZ5Z5Z5Z
1973, Outubro, Let's Get It On, Marvin Gaye, https://open.spotify.com/track/6Z3fsQfKc6c2qzXZ5Z5Z5Z
1973, Novembro, Top of the World, The Carpenters, https://open.spotify.com/track/6Z3fsQfKc6c2qzXZ5Z5Z5Z
1973, Dezembro, Time in a Bottle, Jim Croce, https://open.spotify.com/track/6Z3fsQfKc6c2qzXZ5Z5Z5Z
1974, Janeiro, The Joker, Steve Miller Band, https://open.spotify.com/track/6Z3fsQfKc6c2qzXZ5Z5Z5Z
1974, Fevereiro, Love's Theme, The Love Unlimited Orchestra, https://open.spotify.com/track/6Z3fsQfKc6c2qzXZ5Z5Z5Z
1974, Março, Seasons in the Sun, Terry Jacks, https://open.spotify.com/track/6Z3fsQfKc6c2qzXZ5Z5Z5Z
1974, Abril, The Loco-Motion, Grand Funk Railroad, https://open.spotify.com/track/6Z3fsQfKc6c2qzXZ5Z5Z5Z
1974, Maio, The Streak, Ray Stevens, https://open.spotify.com/track/6Z3fsQfKc6c2qzXZ5Z5Z5Z
1974, Junho, Band on the Run, Paul McCartney & Wings, https://open.spotify.com/track/6Z3fsQfKc6c2qzXZ5Z5Z5Z
1974, Julho, Billy Don't Be a Hero, Bo Donaldson & The Heywoods, https://open.spotify.com/track/6Z3fsQfKc6c2qzXZ5Z5Z5Z
1974, Agosto, Feel Like Makin' Love, Roberta Flack, https://open.spotify.com/track/6Z3fsQfKc6c2qzXZ5Z5Z5Z
1974, Setembro, I Shot the Sheriff, Eric Clapton, https://open.spotify.com/track/6Z3fsQfKc6c2qzXZ5Z5Z5Z
1974, Outubro, You Haven't Done Nothin', Stevie Wonder, https://open.spotify.com/track/6Z3fsQfKc6c2qzXZ5Z5Z5Z
1974, Novembro, Kung Fu Fighting, Carl Douglas, https://open.spotify.com/track/6Z3fsQfKc6c2qzXZ5Z5Z5Z
1974, Dezembro, Cat's in the Cradle, Harry Chapin, https://open.spotify.com/track/6Z3fsQfKc6c2qzXZ5Z5Z5Z
1975, Janeiro, Lucy in the Sky with Diamonds, Elton John, https://open.spotify.com/track/6Z3fsQfKc6c2qzXZ5Z5Z5Z
1975, Fevereiro, Mandy, Barry Manilow, https://open.spotify.com/track/6Z3fsQfKc6c2qzXZ5Z5Z5Z
1975, Março, My Eyes Adored You, Frankie Valli, https://open.spotify.com/track/6Z3fsQfKc6c2qzXZ5Z5Z5Z
1975, Abril, Lovin' You, Minnie Riperton, https://open.spotify.com/track/6Z3fsQfKc6c2qzXZ5Z5Z5Z
1975, Maio, He Don't Love You (Like I Love You), Tony Orlando & Dawn, https://open.spotify.com/track/6Z3fsQfKc6c2qzXZ5Z5Z5Z
1975, Junho, Sister Golden Hair, America, https://open.spotify.com/track/6Z3fsQfKc6c2qzXZ5Z5Z5Z
1975, Julho, Love Will Keep Us Together, Captain & Tennille, https://open.spotify.com/track/6Z3fsQfKc6c2qzXZ5Z5Z5Z
1975, Agosto, Jive Talkin', Bee Gees, https://open.spotify.com/track/6Z3fsQfKc6c2qzXZ5Z5Z5Z
1975, Setembro, Get Down Tonight, KC & The Sunshine Band, https://open.spotify.com/track/6Z3fsQfKc6c2qzXZ5Z5Z5Z
1975, Outubro, Rhinestone Cowboy, Glen Campbell, https://open.spotify.com/track/6Z3fsQfKc6c2qzXZ5Z5Z5Z
1975, Novembro, Island Girl, Elton John, https://open.spotify.com/track/6Z3fsQfKc6c2qzXZ5Z5Z5Z
1975, Dezembro, That's the Way (I Like It), KC & The Sunshine Band, https://open.spotify.com/track/6Z3fsQfKc6c2qzXZ5Z5Z5Z
1976, Janeiro, Saturday Night, Bay City Rollers, https://open.spotify.com/track/6Z3fsQfKc6c2qzXZ5Z5Z5Z
1976, Fevereiro, 50 Ways to Leave Your Lover, Paul Simon, https://open.spotify.com/track/6Z3fsQfKc6c2qzXZ5Z5Z5Z
1976, Março, Love Machine, The Miracles, https://open.spotify.com/track/6Z3fsQfKc6c2qzXZ5Z5Z5Z
1976, Abril, Disco Lady, Johnnie Taylor, https://open.spotify.com/track/6Z3fsQfKc6c2qzXZ5Z5Z5Z
1976, Maio, Silly Love Songs, Wings, https://open.spotify.com/track/6Z3fsQfKc6c2qzXZ5Z5Z5Z
1976, Junho, Love Hangover, Diana Ross, https://open.spotify.com/track/6Z3fsQfKc6c2qzXZ5Z5Z5Z
1976, Julho, Afternoon Delight, Starland Vocal Band, https://open.spotify.com/track/6Z3fsQfKc6c2qzXZ5Z5Z5Z
1976, Agosto, Don't Go Breaking My Heart, Elton John & Kiki Dee, https://open.spotify.com/track/6Z3fsQfKc6c2qzXZ5Z5Z5Z
1976, Setembro, You Should Be Dancing, Bee Gees, https://open.spotify.com/track/6Z3fsQfKc6c2qzXZ5Z5Z5Z
1976, Outubro, Play That Funky Music, Wild Cherry, https://open.spotify.com/track/6Z3fsQfKc6c2qzXZ5Z5Z5Z
1976, Novembro, Tonight's the Night (Gonna Be Alright), Rod Stewart, https://open.spotify.com/track/6Z3fsQfKc6c2qzXZ5Z5Z5Z
1976, Dezembro, You Make Me Feel Like Dancing, Leo Sayer, https://open.spotify.com/track/6Z3fsQfKc6c2qzXZ5Z5Z5Z
1977, Janeiro, Torn Between Two Lovers, Mary MacGregor, https://open.spotify.com/track/6Z3fsQfKc6c2qzXZ5Z5Z5Z
1977, Fevereiro, Blinded by the Light, Manfred Mann's Earth Band, https://open.spotify.com/track/6Z3fsQfKc6c2qzXZ5Z5Z5Z
1977, Março, New Kid in Town, Eagles, https://open.spotify.com/track/6Z3fsQfKc6c2qzXZ5Z5Z5Z
1977, Abril, Rich Girl, Daryl Hall & John Oates, https://open.spotify.com/track/6Z3fsQfKc6c2qzXZ5Z5Z5Z
1977, Maio, Southern Nights, Glen Campbell, https://open.spotify.com/track/6Z3fsQfKc6c2qzXZ5Z5Z5Z
1977, Junho, Dreams, Fleetwood Mac, https://open.spotify.com/track/6Z3fsQfKc6c2qzXZ5Z5Z5Z
1977, Julho, Gonna Fly Now (Theme from 'Rocky'), Bill Conti, https://open.spotify.com/track/6Z3fsQfKc6c2qzXZ5Z5Z5Z
1977, Agosto, I Just Want to Be Your Everything, Andy Gibb, https://open.spotify.com/track/6Z3fsQfKc6c2qzXZ5Z5Z5Z
1977, Setembro, Best of My Love, The Emotions, https://open.spotify.com/track/6Z3fsQfKc6c2qzXZ5Z5Z5Z
1977, Outubro, Star Wars Theme/Cantina Band, Meco, https://open.spotify.com/track/6Z3fsQfKc6c2qzXZ5Z5Z5Z
1977, Novembro, You Light Up My Life, Debby Boone, https://open.spotify.com/track/6Z3fsQfKc6c2qzXZ5Z5Z5Z
1977, Dezembro, How Deep Is Your Love, Bee Gees, https://open.spotify.com/track/6Z3fsQfKc6c2qzXZ5Z5Z5Z
1978, Janeiro, Baby Come Back, Player, https://open.spotify.com/track/6Z3fsQfKc6c2qzXZ5Z5Z5Z
1978, Fevereiro, Stayin' Alive, Bee Gees, https://open.spotify.com/track/6Z3fsQfKc6c2qzXZ5Z5Z5Z
1978, Março, (Love Is) Thicker Than Water, Andy Gibb, https://open.spotify.com/track/6Z3fsQfKc6c2qzXZ5Z5Z5Z
1978, Abril, Night Fever, Bee Gees, https://open.spotify.com/track/6Z3fsQfKc6c2qzXZ5Z5Z5Z
1978, Maio, If I Can't Have You, Yvonne Elliman, https://open.spotify.com/track/6Z3fsQfKc6c2qzXZ5Z5Z5Z
1978, Junho, Shadow Dancing, Andy Gibb, https://open.spotify.com/track/6Z3fsQfKc6c2qzXZ5Z5Z5Z
1978, Julho, Miss You, The Rolling Stones, https://open.spotify.com/track/6Z3fsQfKc6c2qzXZ5Z5Z5Z
1978, Agosto, Three Times a Lady, Commodores, https://open.spotify.com/track/6Z3fsQfKc6c2qzXZ5Z5Z5Z
1978, Setembro, Boogie Oogie Oogie, A Taste of Honey, https://open.spotify.com/track/6Z3fsQfKc6c2qzXZ5Z5Z5Z
1978, Outubro, Kiss You All Over, Exile, https://open.spotify.com/track/6Z3fsQfKc6c2qzXZ5Z5Z5Z
1978, Novembro, You Needed Me, Anne Murray, https://open.spotify.com/track/6Z3fsQfKc6c2qzXZ5Z5Z5Z
1978, Dezembro, Le Freak, Chic, https://open.spotify.com/track/6Z3fsQfKc6c2qzXZ5Z5Z5Z
1979, Janeiro, Too Much Heaven, Bee Gees, https://open.spotify.com/track/6Z3fsQfKc6c2qzXZ5Z5Z5Z
1979, Fevereiro, Da Ya Think I'm Sexy?, Rod Stewart, https://open.spotify.com/track/6Z3fsQfKc6c2qzXZ5Z5Z5Z
1979, Março, Tragedy, Bee Gees, https://open.spotify.com/track/6Z3fsQfKc6c2qzXZ5Z5Z5Z
1979, Abril, I Will Survive, Gloria Gaynor, https://open.spotify.com/track/6Z3fsQfKc6c2qzXZ5Z5Z5Z
1979, Maio, Hot Stuff, Donna Summer, https://open.spotify.com/track/6Z3fsQfKc6c2qzXZ5Z5Z5Z
1979, Junho, Love You Inside Out, Bee Gees, https://open.spotify.com/track/6Z3fsQfKc6c2qzXZ5Z5Z5Z
1979, Julho, Ring My Bell, Anita Ward, https://open.spotify.com/track/6Z3fsQfKc6c2qzXZ5Z5Z5Z
1979, Agosto, Bad Girls, Donna Summer, https://open.spotify.com/track/6Z3fsQfKc6c2qzXZ5Z5Z5Z
1979, Setembro, My Sharona, The Knack, https://open.spotify.com/track/6Z3fsQfKc6c2qzXZ5Z5Z5Z
1979, Outubro, Sad Eyes, Robert John, https://open.spotify.com/track/6Z3fsQfKc6c2qzXZ5Z5Z5Z
1979, Novembro, Rise, Herb Alpert, https://open.spotify.com/track/6Z3fsQfKc6c2qzXZ5Z5Z5Z
1979, Dezembro, Escape (The Piña Colada Song), Rupert Holmes, https://open.spotify.com/track/6Z3fsQfKc6c2qzXZ5Z5Z5Z
1980, Janeiro, Escape (The Piña Colada Song), Rupert Holmes, https://open.spotify.com/track/6Z3fsQfKc6c2qzXZ5Z5Z5Z
1980, Fevereiro, Rock with You, Michael Jackson, https://open.spotify.com/track/6Z3fsQfKc6c2qzXZ5Z5Z5Z
1980, Março, Crazy Little Thing Called Love, Queen, https://open.spotify.com/track/6Z3fsQfKc6c2qzXZ5Z5Z5Z
1980, Abril, Call Me, Blondie, https://open.spotify.com/track/6Z3fsQfKc6c2qzXZ5Z5Z5Z
1980, Maio, Funkytown, Lipps Inc., https://open.spotify.com/track/6Z3fsQfKc6c2qzXZ5Z5Z5Z
1980, Junho, Coming Up, Paul McCartney, https://open.spotify.com/track/6Z3fsQfKc6c2qzXZ5Z5Z5Z
1980, Julho, It's Still Rock and Roll to Me, Billy Joel, https://open.spotify.com/track/6Z3fsQfKc6c2qzXZ5Z5Z5Z
1980, Agosto, Magic, Olivia Newton-John, https://open.spotify.com/track/6Z3fsQfKc6c2qzXZ5Z5Z5Z
1980, Setembro, Upside Down, Diana Ross, https://open.spotify.com/track/6Z3fsQfKc6c2qzXZ5Z5Z5Z
1980, Outubro, Another One Bites the Dust, Queen, https://open.spotify.com/track/6Z3fsQfKc6c2qzXZ5Z5Z5Z
