1980, Novembro, Woman in Love, Barbra Streisand, https://open.spotify.com/track/6Z3fsQfKc6c2qzXZ5Z5Z5Z
1980, Dezembro, (Just Like) Starting Over, John Lennon, https://open.spotify.com/track/6Z3fsQfKc6c2qzXZ5Z5Z5Z
1981, Janeiro, The Tide Is High, Blondie, https://open.spotify.com/track/6Z3fsQfKc6c2qzXZ5Z5Z5Z
1981, Fevereiro, Celebration, Kool & The Gang, https://open.spotify.com/track/6Z3fsQfKc6c2qzXZ5Z5Z5Z
1981, Março, 9 to 5, Dolly Parton, https://open.spotify.com/track/6Z3fsQfKc6c2qzXZ5Z5Z5Z
1981, Abril, Kiss on My List, Daryl Hall & John Oates, https://open.spotify.com/track/6Z3fsQfKc6c2qzXZ5Z5Z5Z
1981, Maio, Bette Davis Eyes, Kim Carnes, https://open.spotify.com/track/6Z3fsQfKc6c2qzXZ5Z5Z5Z
1981, Junho, Medley: Intro Venus / Sugar Sugar / No Reply / I'll Be Back / Drive My Car / Do You Want to Know a Secret / We Can Work It Out / I Should Have Known Better / Nowhere Man / You're Going to Lose That Girl / Stars on 45, Stars on 45, https://open.spotify.com/track/6Z3fsQfKc6c2qzXZ5Z5Z5Z
1981, Julho, Jessie's Girl, Rick Springfield, https://open.spotify.com/track/6Z3fsQfKc6c2qzXZ5Z5Z5Z
1981, Agosto, Endless Love, Diana Ross & Lionel Richie, https://open.spotify.com/track/6Z3fsQfKc6c2qzXZ5Z5Z5Z
1981, Setembro, Arthur's Theme (Best That You Can Do), Christopher Cross, https://open.spotify.com/track/6Z3fsQfKc6c2qzXZ5Z5Z5Z
1981, Outubro, Private Eyes, Daryl Hall & John Oates, https://open.spotify.com/track/6Z3fsQfKc6c2qzXZ5Z5Z5Z
1981, Novembro, Physical, Olivia Newton-John, https://open.spotify.com/track/6Z3fsQfKc6c2qzXZ5Z5Z5Z
1981, Dezembro, Physical, Olivia Newton-John, https://open.spotify.com/track/6Z3fsQfKc6c2qzXZ5Z5Z5Z
1982, Janeiro, Physical, Olivia Newton-John, https://open.spotify.com/track/6Z3fsQfKc6c2qzXZ5Z5Z5Z
1982, Fevereiro, Centerfold, The J. Geils Band, https://open.spotify.com/track/6Z3fsQfKc6c2qzXZ5Z5Z5Z
1982, Março, I Love Rock 'n Roll, Joan Jett & The Blackhearts, https://open.spotify.com/track/6Z3fsQfKc6c2qzXZ5Z5Z5Z
1982, Abril, Chariots of Fire - Titles, Vangelis, https://open.spotify.com/track/6Z3fsQfKc6c2qzXZ5Z5Z5Z
1982, Maio, Ebony and Ivory, Paul McCartney & Stevie Wonder, https://open.spotify.com/track/6Z3fsQfKc6c2qzXZ5Z5Z5Z
1982, Junho, Don't You Want Me, The Human League, https://open.spotify.com/track/6Z3fsQfKc6c2qzXZ5Z5Z5Z
1982, Julho, Eye of the Tiger, Survivor, https://open.spotify.com/track/6Z3fsQfKc6c2qzXZ5Z5Z5Z
1982, Agosto, Abracadabra, The Steve Miller Band, https://open.spotify.com/track/6Z3fsQfKc6c2qzXZ5Z5Z5Z
1982, Setembro, Hard to Say I'm Sorry, Chicago, https://open.spotify.com/track/6Z3fsQfKc6c2qzXZ5Z5Z5Z
1982, Outubro, Jack & Diane, John Mellencamp, https://open.spotify.com/track/6Z3fsQfKc6c2qzXZ5Z5Z5Z
1982, Novembro, Up Where We Belong, Joe Cocker & Jennifer Warnes, https://open.spotify.com/track/6Z3fsQfKc6c2qzXZ5Z5Z5Z
1982, Dezembro, Maneater, Daryl Hall & John Oates, https://open.spotify.com/track/6Z3fsQfKc6c2qzXZ5Z5Z5Z
1983, Janeiro, Down Under, Men at Work, https://open.spotify.com/track/6Z3fsQfKc6c2qzXZ5Z5Z5Z
1983, Fevereiro, Baby Come to Me, Patti Austin & James Ingram, https://open.spotify.com/track/6Z3fsQfKc6c2qzXZ5Z5Z5Z
1983, Março, Billie Jean, Michael Jackson, https://open.spotify.com/track/6Z3fsQfKc6c2qzXZ5Z5Z5Z
1983, Abril, Come On Eileen, Dexys Midnight Runners, https://open.spotify.com/track/6Z3fsQfKc6c2qzXZ5Z5Z5Z
1983, Maio, Beat It, Michael Jackson, https://open.spotify.com/track/6Z3fsQfKc6c2qzXZ5Z5Z5Z
1983, Junho, Flashdance... What a Feeling, Irene Cara, https://open.spotify.com/track/6Z3fsQfKc6c2qzXZ5Z5Z5Z
1983, Julho, Every Breath You Take, The Police, https://open.spotify.com/track/6Z3fsQfKc6c2qzXZ5Z5Z5Z
1983, Agosto, Sweet Dreams (Are Made of This), Eurythmics, https://open.spotify.com/track/6Z3fsQfKc6c2qzXZ5Z5Z5Z
1983, Setembro, Maniac, Michael Sembello, https://open.spotify.com/track/6Z3fsQfKc6c2qzXZ5Z5Z5Z
1983, Outubro, Total Eclipse of the Heart, Bonnie Tyler, https://open.spotify.com/track/6Z3fsQfKc6c2qzXZ5Z5Z5Z
1983, Novembro, All Night Long (All Night), Lionel Richie, https://open.spotify.com/track/6Z3fsQfKc6c2qzXZ5Z5Z5Z
1983, Dezembro, Say Say Say, Paul McCartney & Michael Jackson, https://open.spotify.com/track/6Z3fsQfKc6c2qzXZ5Z5Z5Z
1984, Janeiro, Owner of a Lonely Heart, Yes, https://open.spotify.com/track/6Z3fsQfKc6c2qzXZ5Z5Z5Z
1984, Fevereiro, Karma Chameleon, Culture Club, https://open.spotify.com/track/6Z3fsQfKc6c2qzXZ5Z5Z5Z
1984, Março, Jump, Van Halen, https://open.spotify.com/track/6Z3fsQfKc6c2qzXZ5Z5Z5Z
1984, Abril, Footloose, Kenny Loggins, https://open.spotify.com/track/6Z3fsQfKc6c2qzXZ5Z5Z5Z
1984, Maio, Against All Odds (Take a Look at Me Now), Phil Collins, https://open.spotify.com/track/6Z3fsQfKc6c2qzXZ5Z5Z5Z
1984, Junho, Time After Time, Cyndi Lauper, https://open.spotify.com/track/6Z3fsQfKc6c2qzXZ5Z5Z5Z
1984, Julho, The Reflex, Duran Duran, https://open.spotify.com/track/6Z3fsQfKc6c2qzXZ5Z5Z5Z
1984, Agosto, When Doves Cry, Prince, https://open.spotify.com/track/6Z3fsQfKc6c2qzXZ5Z5Z5Z
1984, Setembro, Ghostbusters, Ray Parker Jr., https://open.spotify.com/track/6Z3fsQfKc6c2qzXZ5Z5Z5Z
1984, Outubro, Let's Go Crazy, Prince & The Revolution, https://open.spotify.com/track/6Z3fsQfKc6c2qzXZ5Z5Z5Z
1984, Novembro, Caribbean Queen (No More Love on the Run), Billy Ocean, https://open.spotify.com/track/6Z3fsQfKc6c2qzXZ5Z5Z5Z
1984, Dezembro, Wake Me Up Before You Go-Go, Wham!, https://open.spotify.com/track/6Z3fsQfKc6c2qzXZ5Z5Z5Z
1985, Janeiro, Like a Virgin, Madonna, https://open.spotify.com/track/6Z3fsQfKc6c2qzXZ5Z5Z5Z
1985, Fevereiro, I Want to Know What Love Is, Foreigner, https://open.spotify.com/track/6Z3fsQfKc6c2qzXZ5Z5Z5Z
1985, Março, Careless Whisper, Wham! featuring George Michael, https://open.spotify.com/track/6Z3fsQfKc6c2qzXZ5Z5Z5Z
1985, Abril, We Are the World, USA for Africa, https://open.spotify.com/track/6Z3fsQfKc6c2qzXZ5Z5Z5Z
1985, Maio, Crazy for You, Madonna, https://open.spotify.com/track/6Z3fsQfKc6c2qzXZ5Z5Z5Z
1985, Junho, Everybody Wants to Rule the World, Tears for Fears, https://open.spotify.com/track/6Z3fsQfKc6c2qzXZ5Z5Z5Z
1985, Julho, A View to a Kill, Duran Duran, https://open.spotify.com/track/6Z3fsQfKc6c2qzXZ5Z5Z5Z
1985, Agosto, Shout, Tears for Fears, https://open.spotify.com/track/6Z3fsQfKc6c2qzXZ5Z5Z5Z
1985, Setembro, Money for Nothing, Dire Straits, https://open.spotify.com/track/6Z3fsQfKc6c2qzXZ5Z5Z5Z
1985, Outubro, Take on Me, a-ha, https://open.spotify.com/track/6Z3fsQfKc6c2qzXZ5Z5Z5Z
1985, Novembro, Separate Lives, Phil Collins & Marilyn Martin, https://open.spotify.com/track/6Z3fsQfKc6c2qzXZ5Z5Z5Z
1985, Dezembro, Say You Say Me, Lionel Richie, https://open.spotify.com/track/6Z3fsQfKc6c2qzXZ5Z5Z5Z
1986, Janeiro, That's What Friends Are For, Dionne & Friends, https://open.spotify.com/track/6Z3fsQfKc6c2qzXZ5Z5Z5Z
1986, Fevereiro, How Will I Know, Whitney Houston, https://open.spotify.com/track/6Z3fsQfKc6c2qzXZ5Z5Z5Z
1986, Março, Kiss, Prince & The Revolution, https://open.spotify.com/track/6Z3fsQfKc6c2qzXZ5Z5Z5Z
1986, Abril, Rock Me Amadeus, Falco, https://open.spotify.com/track/6Z3fsQfKc6c2qzXZ5Z5Z5Z
1986, Maio, Greatest Love of All, Whitney Houston, https://open.spotify.com/track/6Z3fsQfKc6c2qzXZ5Z5Z5Z
1986, Junho, On My Own, Patti LaBelle & Michael McDonald, https://open.spotify.com/track/6Z3fsQfKc6c2qzXZ5Z5Z5Z
1986, Julho, There'll Be Sad Songs (To Make You Cry), Billy Ocean, https://open.spotify.com/track/6Z3fsQfKc6c2qzXZ5Z5Z5Z
1986, Agosto, Venus, Bananarama, https://open.spotify.com/track/6Z3fsQfKc6c2qzXZ5Z5Z5Z
1986, Setembro, Take My Breath Away, Berlin, https://open.spotify.com/track/6Z3fsQfKc6c2qzXZ5Z5Z5Z
1986, Outubro, Stuck with You, Huey Lewis & The News, https://open.spotify.com/track/6Z3fsQfKc6c2qzXZ5Z5Z5Z
1986, Novembro, Walk Like an Egyptian, The Bangles, https://open.spotify.com/track/6Z3fsQfKc6c2qzXZ5Z5Z5Z
1986, Dezembro, You Give Love a Bad Name, Bon Jovi, https://open.spotify.com/track/6Z3fsQfKc6c2qzXZ5Z5Z5Z
1987, Janeiro, Shake You Down, Gregory Abbott, https://open.spotify.com/track/6Z3fsQfKc6c2qzXZ5Z5Z5Z
1987, Fevereiro, Livin' on a Prayer, Bon Jovi, https://open.spotify.com/track/6Z3fsQfKc6c2qzXZ5Z5Z5Z
1987, Março, Lean on Me, Club Nouveau, https://open.spotify.com/track/6Z3fsQfKc6c2qzXZ5Z5Z5Z
1987, Abril, Nothing's Gonna Stop Us Now, Starship, https://open.spotify.com/track/6Z3fsQfKc6c2qzXZ5Z5Z5Z
1987, Maio, I Knew You Were Waiting (For Me), Aretha Franklin & George Michael, https://open.spotify.com/track/6Z3fsQfKc6c2qzXZ5Z5Z5Z
1987, Junho, With or Without You, U2, https://open.spotify.com/track/6Z3fsQfKc6c2qzXZ5Z5Z5Z
1987, Julho, Alone, Heart, https://open.spotify.com/track/6Z3fsQfKc6c2qzXZ5Z5Z5Z
1987, Agosto, Who's That Girl, Madonna, https://open.spotify.com/track/6Z3fsQfKc6c2qzXZ5Z5Z5Z
1987, Setembro, La Bamba, Los Lobos, https://open.spotify.com/track/6Z3fsQfKc6c2qzXZ5Z5Z5Z
1987, Outubro, Bad, Michael Jackson, https://open.spotify.com/track/6Z3fsQfKc6c2qzXZ5Z5Z5Z
1987, Novembro, I Think We're Alone Now, Tiffany, https://open.spotify.com/track/6Z3fsQfKc6c2qzXZ5Z5Z5Z
1987, Dezembro, Faith, George Michael, https://open.spotify.com/track/6Z3fsQfKc6c2qzXZ5Z5Z5Z
1988, Janeiro, Got My Mind Set on You, George Harrison, https://open.spotify.com/track/6Z3fsQfKc6c2qzXZ5Z5Z5Z
1988, Fevereiro, Need You Tonight, INXS, https://open.spotify.com/track/6Z3fsQfKc6c2qzXZ5Z5Z5Z
1988, Março, Never Gonna Give You Up, Rick Astley, https://open.spotify.com/track/6Z3fsQfKc6c2qzXZ5Z5Z5Z
1988, Abril, Man in the Mirror, Michael Jackson, https://open.spotify.com/track/6Z3fsQfKc6c2qzXZ5Z5Z5Z
1988, Maio, Anything for You, Gloria Estefan & Miami Sound Machine, https://open.spotify.com/track/6Z3fsQfKc6c2qzXZ5Z5Z5Z
1988, Junho, One More Try, George Michael, https://open.spotify.com/track/6Z3fsQfKc6c2qzXZ5Z5Z5Z
1988, Julho, The Flame, Cheap Trick, https://open.spotify.com/track/6Z3fsQfKc6c2qzXZ5Z5Z5Z
1988, Agosto, Roll with It, Steve Winwood, https://open.spotify.com/track/6Z3fsQfKc6c2qzXZ5Z5Z5Z
1988, Setembro, Sweet Child o' Mine, Guns N' Roses, https://open.spotify.com/track/6Z3fsQfKc6c2qzXZ5Z5Z5Z
1988, Outubro, Don't Worry Be Happy, Bobby McFerrin, https://open.spotify.com/track/6Z3fsQfKc6c2qzXZ5Z5Z5Z
1988, Novembro, Bad Medicine, Bon Jovi, https://open.spotify.com/track/6Z3fsQfKc6c2qzXZ5Z5Z5Z
1988, Dezembro, Every Rose Has Its Thorn, Poison, https://open.spotify.com/track/6Z3fsQfKc6c2qzXZ5Z5Z5Z
1989, Janeiro, My Prerogative, Bobby Brown, https://open.spotify.com/track/6Z3fsQfKc6c2qzXZ5Z5Z5Z
1989, Fevereiro, Straight Up, Paula Abdul, https://open.spotify.com/track/6Z3fsQfKc6c2qzXZ5Z5Z5Z
1989, Março, Lost in Your Eyes, Debbie Gibson, https://open.spotify.com/track/6Z3fsQfKc6c2qzXZ5Z5Z5Z
1989, Abril, The Look, Roxette, https://open.spotify.com/track/6Z3fsQfKc6c2qzXZ5Z5Z5Z
1989, Maio, She Drives Me Crazy, Fine Young Cannibals, https://open.spotify.com/track/6Z3fsQfKc6c2qzXZ5Z5Z5Z
1989, Junho, Rock On, Michael Damian, https://open.spotify.com/track/6Z3fsQfKc6c2qzXZ5Z5Z5Z
1989, Julho, Batdance, Prince, https://open.spotify.com/track/6Z3fsQfKc6c2qzXZ5Z5Z5Z
1989, Agosto, Right Here Waiting, Richard Marx, https://open.spotify.com/track/6Z3fsQfKc6c2qzXZ5Z5Z5Z
1989, Setembro, Cold Hearted, Paula Abdul, https://open.spotify.com/track/6Z3fsQfKc6c2qzXZ5Z5Z5Z
1989, Outubro, Miss You Much, Janet Jackson, https://open.spotify.com/track/6Z3fsQfKc6c2qzXZ5Z5Z5Z
1989, Novembro, Listen to Your Heart, Roxette, https://open.spotify.com/track/6Z3fsQfKc6c2qzXZ5Z5Z5Z
1989, Dezembro, Another Day in Paradise, Phil Collins, https://open.spotify.com/track/6Z3fsQfKc6c2qzXZ5Z5Z5Z
1990, Janeiro, Another Day in Paradise, Phil Collins, https://open.spotify.com/track/6Z3fsQfKc6c2qzXZ5Z5Z5Z
1990, Fevereiro, Opposites Attract, Paula Abdul, https://open.spotify.com/track/6Z3fsQfKc6c2qzXZ5Z5Z5Z
1990, Março, Black Velvet, Alannah Myles, https://open.spotify.com/track/6Z3fsQfKc6c2qzXZ5Z5Z5Z
1990, Abril, Love Will Lead You Back, Taylor Dayne, https://open.spotify.com/track/6Z3fsQfKc6c2qzXZ5Z5Z5Z
1990, Maio, Nothing Compares 2 U, Sinéad O'Connor, https://open.spotify.com/track/6Z3fsQfKc6c2qzXZ5Z5Z5Z
1990, Junho, Vogue, Madonna, https://open.spotify.com/track/6Z3fsQfKc6c2qzXZ5Z5Z5Z
1990, Julho, Step by Step, New Kids on the Block, https://open.spotify.com/track/6Z3fsQfKc6c2qzXZ5Z5Z5Z
1990, Agosto, She Ain't Worth It, Glenn Medeiros featuring Bobby Brown, https://open.spotify.com/track/6Z3fsQfKc6c2qzXZ5Z5Z5Z
1990, Setembro, Blaze of Glory, Jon Bon Jovi, https://open.spotify.com/track/6Z3fsQfKc6c2qzXZ5Z5Z5Z
1990, Outubro, Release Me, Wilson Phillips, https://open.spotify.com/track/6Z3fsQfKc6c2qzXZ5Z5Z5Z
1990, Novembro, I Don't Have the Heart, James Ingram, https://open.spotify.com/track/6Z3fsQfKc6c2qzXZ5Z5Z5Z
1990, Dezembro, Because I Love You (The Postman Song), Stevie B, https://open.spotify.com/track/6Z3fsQfKc6c2qzXZ5Z5Z5Z
1991, Janeiro, Justify My Love, Madonna, https://open.spotify.com/track/6Z3fsQfKc6c2qzXZ5Z5Z5Z
1991, Fevereiro, Gonna Make You Sweat (Everybody Dance Now), C+C Music Factory featuring Freedom Williams, https://open.spotify.com/track/6Z3fsQfKc6c2qzXZ5Z5Z5Z
1991, Março, All the Man That I Need, Whitney Houston, https://open.spotify.com/track/6Z3fsQfKc6c2qzXZ5Z5Z5Z
1991, Abril, One More Try, Timmy T, https://open.spotify.com/track/6Z3fsQfKc6c2qzXZ5Z5Z5Z
1991, Maio, I Don't Wanna Cry, Mariah Carey, https://open.spotify.com/track/6Z3fsQfKc6c2qzXZ5Z5Z5Z
1991, Junho, Rush Rush, Paula Abdul, https://open.spotify.com/track/6Z3fsQfKc6c2qzXZ5Z5Z5Z
1991, Julho, Unbelievable, EMF, https://open.spotify.com/track/6Z3fsQfKc6c2qzXZ5Z5Z5Z
1991, Agosto, (Everything I Do) I Do It for You, Bryan Adams, https://open.spotify.com/track/6Z3fsQfKc6c2qzXZ5Z5Z5Z
1991, Setembro, The Promise of a New Day, Paula Abdul, https://open.spotify.com/track/6Z3fsQfKc6c2qzXZ5Z5Z5Z
1991, Outubro, Good Vibrations, Marky Mark and the Funky Bunch featuring Loleatta Holloway, https://open.spotify.com/track/6Z3fsQfKc6c2qzXZ5Z5Z5Z
1991, Novembro, Emotions, Mariah Carey, https://open.spotify.com/track/6Z3fsQfKc6c2qzXZ5Z5Z5Z
1991, Dezembro, Black or White, Michael Jackson, https://open.spotify.com/track/6Z3fsQfKc6c2qzXZ5Z5Z5Z
1992, Janeiro, All 4 Love, Color Me Badd, https://open.spotify.com/track/6Z3fsQfKc6c2qzXZ5Z5Z5Z
1992, Fevereiro, Don't Let the Sun Go Down on Me, George Michael & Elton John, https://open.spotify.com/track/6Z3fsQfKc6c2qzXZ5Z5Z5Z
1992, Março, Tears in Heaven, Eric Clapton, https://open.spotify.com/track/6Z3fsQfKc6c2qzXZ5Z5Z5Z
1992, Abril, Save the Best for Last, Vanessa Williams, https://open.spotify.com/track/6Z3fsQfKc6c2qzXZ5Z5Z5Z
1992, Maio, Jump, Kris Kross, https://open.spotify.com/track/6Z3fsQfKc6c2qzXZ5Z5Z5Z
1992, Junho, I'll Be There, Mariah Carey, https://open.spotify.com/track/6Z3fsQfKc6c2qzXZ5Z5Z5Z
1992, Julho, Baby Got Back, Sir Mix-a-Lot, https://open.spotify.com/track/6Z3fsQfKc6c2qzXZ5Z5Z5Z
1992, Agosto, End of the Road, Boyz II Men, https://open.spotify.com/track/6Z3fsQfKc6c2qzXZ5Z5Z5Z
1992, Setembro, Sometimes Love Just Ain't Enough, Patty Smyth featuring Don Henley, https://open.spotify.com/track/6Z3fsQfKc6c2qzXZ5Z5Z5Z
1992, Outubro, Jump Around, House of Pain, https://open.spotify.com/track/6Z3fsQfKc6c2qzXZ5Z5Z5Z
1992, Novembro, How Do You Talk to an Angel, The Heights, https://open.spotify.com/track/6Z3fsQfKc6c2qzXZ5Z5Z5Z
1992, Dezembro, I Will Always Love You, Whitney Houston, https://open.spotify.com/track/6Z3fsQfKc6c2qzXZ5Z5Z5Z
1993, Janeiro, I Will Always Love You, Whitney Houston, https://open.spotify.com/track/6Z3fsQfKc6c2qzXZ5Z5Z5Z
1993, Fevereiro, A Whole New World, Peabo Bryson & Regina Belle, https://open.spotify.com/track/6Z3fsQfKc6c2qzXZ5Z5Z5Z
1993, Março, Informer, Snow, https://open.spotify.com/track/6Z3fsQfKc6c2qzXZ5Z5Z5Z
1993, Abril, Freak Me, Silk, https://open.spotify.com/track/6Z3fsQfKc6c2qzXZ5Z5Z5Z
1993, Maio, That's the Way Love Goes, Janet Jackson, https://open.spotify.com/track/6Z3fsQfKc6c2qzXZ5Z5Z5Z
1993, Junho, Weak, SWV, https://open.spotify.com/track/6Z3fsQfKc6c2qzXZ5Z5Z5Z
1993, Julho, Can't Help Falling in Love, UB40, https://open.spotify.com/track/6Z3fsQfKc6c2qzXZ5Z5Z5Z
1993, Agosto, Dreamlover, Mariah Carey, https://open.spotify.com/track/6Z3fsQfKc6c2qzXZ5Z5Z5Z
1993, Setembro, Right Here (Human Nature) / Downtempo, SWV, https://open.spotify.com/track/6Z3fsQfKc6c2qzXZ5Z5Z5Z
1993, Outubro, I'd Do Anything for Love (But I Won't Do That), Meat Loaf, https://open.spotify.com/track/6Z3fsQfKc6c2qzXZ5Z5Z5Z
1993, Novembro, Again, Janet Jackson, https://open.spotify.com/track/6Z3fsQfKc6c2qzXZ5Z5Z5Z
1993, Dezembro, Hero, Mariah Carey, https://open.spotify.com/track/6Z3fsQfKc6c2qzXZ5Z5Z5Z
1994, Janeiro, Hero, Mariah Carey, https://open.spotify.com/track/6Z3fsQfKc6c2qzXZ5Z5Z5Z
1994, Fevereiro, All for Love, Bryan Adams;  Rod Stewart & Sting, https://open.spotify.com/track/6Z3fsQfKc6c2qzXZ5Z5Z5Z
1994, Março, The Power of Love, Céline Dion, https://open.spotify.com/track/6Z3fsQfKc6c2qzXZ5Z5Z5Z
1994, Abril, The Sign, Ace of Base, https://open.spotify.com/track/6Z3fsQfKc6c2qzXZ5Z5Z5Z
1994, Maio, I Swear, All-4-One, https://open.spotify.com/track/6Z3fsQfKc6c2qzXZ5Z5Z5Z
1994, Junho, I'll Make Love to You, Boyz II Men, https://open.spotify.com/track/6Z3fsQfKc6c2qzXZ5Z5Z5Z
1994, Julho, Stay (I Missed You), Lisa Loeb & Nine Stories, https://open.spotify.com/track/6Z3fsQfKc6c2qzXZ5Z5Z5Z
1994, Agosto, I'll Be There, Mariah Carey, https://open.spotify.com/track/6Z3fsQfKc6c2qzXZ5Z5Z5Z
1994, Setembro, I'll Be There, Mariah Carey, https://open.spotify.com/track/6Z3fsQfKc6c2qzXZ5Z5Z5Z
1994, Outubro, On Bended Knee, Boyz II Men, https://open.spotify.com/track/6Z3fsQfKc6c2qzXZ5Z5Z5Z
1994, Novembro, Here Comes the Hotstepper, Ini Kamoze, https://open.spotify.com/track/6Z3fsQfKc6c2qzXZ5Z5Z5Z
1994, Dezembro, On Bended Knee, Boyz II Men, https://open.spotify.com/track/6Z3fsQfKc6c2qzXZ5Z5Z5Z
1995, Janeiro, Creep, TLC, https://open.spotify.com/track/6Z3fsQfKc6c2qzXZ5Z5Z5Z
1995, Fevereiro, Take a Bow, Madonna, https://open.spotify.com/track/6Z3fsQfKc6c2qzXZ5Z5Z5Z
1995, Março, This Is How We Do It, Montell Jordan, https://open.spotify.com/track/6Z3fsQfKc6c2qzXZ5Z5Z5Z
1995, Abril, Have You Ever Really Loved a Woman?, Bryan Adams, https://open.spotify.com/track/6Z3fsQfKc6c2qzXZ5Z5Z5Z
1995, Maio, Waterfalls, TLC, https://open.spotify.com/track/6Z3fsQfKc6c2qzXZ5Z5Z5Z
1995, Junho, You Are Not Alone, Michael Jackson, https://open.spotify.com/track/6Z3fsQfKc6c2qzXZ5Z5Z5Z
1995, Julho, Kiss from a Rose, Seal, https://open.spotify.com/track/6Z3fsQfKc6c2qzXZ5Z5Z5Z
1995, Agosto, Gangsta's Paradise, Coolio featuring L.V., https://open.spotify.com/track/6Z3fsQfKc6c2qzXZ5Z5Z5Z
1995, Setembro, Fantasy, Mariah Carey, https://open.spotify.com/track/6Z3fsQfKc6c2qzXZ5Z5Z5Z
1995, Outubro, Exhale (Shoop Shoop), Whitney Houston, https://open.spotify.com/track/6Z3fsQfKc6c2qzXZ5Z5Z5Z
1995, Novembro, One Sweet Day, Mariah Carey & Boyz II Men, https://open.spotify.com/track/6Z3fsQfKc6c2qzXZ5Z5Z5Z
1995, Dezembro, One Sweet Day, Mariah Carey & Boyz II Men, https://open.spotify.com/track/6Z3fsQfKc6c2qzXZ5Z5Z5Z
1996, Janeiro, One Sweet Day, Mariah Carey & Boyz II Men, https://open.spotify.com/track/6Z3fsQfKc6c2qzXZ5Z5Z5Z
1996, Fevereiro, Because You Loved Me, Céline Dion, https://open.spotify.com/track/6Z3fsQfKc6c2qzXZ5Z5Z5Z
1996, Março, Always Be My Baby, Mariah Carey, https://open.spotify.com/track/6Z3fsQfKc6c2qzXZ5Z5Z5Z
1996, Abril, Tha Crossroads, Bone Thugs-N-Harmony, https://open.spotify.com/track/6Z3fsQfKc6c2qzXZ5Z5Z5Z
1996, Maio, Tha Crossroads, Bone Thugs-N-Harmony, https://open.spotify.com/track/6Z3fsQfKc6c2qzXZ5Z5Z5Z
1996, Junho, How Do U Want It, 2Pac featuring K-Ci & JoJo, https://open.spotify.com/track/6Z3fsQfKc6c2qzXZ5Z5Z5Z
1996, Julho, Macarena (Bayside Boys Mix), Los Del Río, https://open.spotify.com/track/6Z3fsQfKc6c2qzXZ5Z5Z5Z
1996, Agosto, Macarena (Bayside Boys Mix), Los Del Río, https://open.spotify.com/track/6Z3fsQfKc6c2qzXZ5Z5Z5Z
1996, Setembro, Macarena (Bayside Boys Mix), Los Del Río, https://open.spotify.com/track/6Z3fsQfKc6c2qzXZ5Z5Z5Z
1996, Outubro, Macarena (Bayside Boys Mix), Los Del Río, https://open.spotify.com/track/6Z3fsQfKc6c2qzXZ5Z5Z5Z
1996, Novembro, Un-Break My Heart, Toni Braxton, https://open.spotify.com/track/6Z3fsQfKc6c2qzXZ5Z5Z5Z
1996, Dezembro, Un-Break My Heart, Toni Braxton, https://open.spotify.com/track/6Z3fsQfKc6c2qzXZ5Z5Z5Z
1997, Janeiro, Un-Break My Heart, Toni Braxton, https://open.spotify.com/track/6Z3fsQfKc6c2qzXZ5Z5Z5Z
1997, Fevereiro, Wannabe, Spice Girls, https://open.spotify.com/track/6Z3fsQfKc6c2qzXZ5Z5Z5Z
1997, Março, Can't Nobody Hold Me Down, Puff Daddy featuring Mase, https://open.spotify.com/track/6Z3fsQfKc6c2qzXZ5Z5Z5Z
1997, Abril, Hypnotize, The Notorious B.I.G., https://open.spotify.com/track/6Z3fsQfKc6c2qzXZ5Z5Z5Z
1997, Maio, MMMBop, Hanson, https://open.spotify.com/track/6Z3fsQfKc6c2qzXZ5Z5Z5Z
1997, Junho, I'll Be Missing You, Puff Daddy & Faith Evans featuring 112, https://open.spotify.com/track/6Z3fsQfKc6c2qzXZ5Z5Z5Z
1997, Julho, Mo Money Mo Problems, The Notorious B.I.G. featuring Puff Daddy & Mase, https://open.spotify.com/track/6Z3fsQfKc6c2qzXZ5Z5Z5Z
1997, Agosto, Honey, Mariah Carey, https://open.spotify.com/track/6Z3fsQfKc6c2qzXZ5Z5Z5Z
1997, Setembro, Candle in the Wind 1997, Elton John, https://open.spotify.com/track/6Z3fsQfKc6c2qzXZ5Z5Z5Z
1997, Outubro, Candle in the Wind 1997, Elton John, https://open.spotify.com/track/6Z3fsQfKc6c2qzXZ5Z5Z5Z
1997, Novembro, Candle in the Wind 1997, Elton John, https://open.spotify.com/track/6Z3fsQfKc6c2qzXZ5Z5Z5Z
1997, Dezembro, Candle in the Wind 1997, Elton John, https://open.spotify.com/track/6Z3fsQfKc6c2qzXZ5Z5Z5Z
1998, Janeiro, Candle in the Wind 1997, Elton John, https://open.spotify.com/track/6Z3fsQfKc6c2qzXZ5Z5Z5Z
1998, Fevereiro, Together Again, Janet Jackson, https://open.spotify.com/track/6Z3fsQfKc6c2qzXZ5Z5Z5Z
1998, Março, My Heart Will Go On, Céline Dion, https://open.spotify.com/track/6Z3fsQfKc6c2qzXZ5Z5Z5Z
1998, Abril, Too Close, Next, https://open.spotify.com/track/6Z3fsQfKc6c2qzXZ5Z5Z5Z
1998, Maio, Too Close, Next, https://open.spotify.com/track/6Z3fsQfKc6c2qzXZ5Z5Z5Z
1998, Junho, The Boy Is Mine, Brandy & Monica, https://open.spotify.com/track/6Z3fsQfKc6c2qzXZ5Z5Z5Z
1998, Julho, The Boy Is Mine, Brandy & Monica, https://open.spotify.com/track/6Z3fsQfKc6c2qzXZ5Z5Z5Z
1998, Agosto, The Boy Is Mine, Brandy & Monica, https://open.spotify.com/track/6Z3fsQfKc6c2qzXZ5Z5Z5Z
1998, Setembro, I Don't Want to Miss a Thing, Aerosmith, https://open.spotify.com/track/6Z3fsQfKc6c2qzXZ5Z5Z5Z
1998, Outubro, I Don't Want to Miss a Thing, Aerosmith, https://open.spotify.com/track/6Z3fsQfKc6c2qzXZ5Z5Z5Z
1998, Novembro, I Don't Want to Miss a Thing, Aerosmith, https://open.spotify.com/track/6Z3fsQfKc6c2qzXZ5Z5Z5Z
1998, Dezembro, I Don't Want to Miss a Thing, Aerosmith, https://open.spotify.com/track/6Z3fsQfKc6c2qzXZ5Z5Z5Z
1999, Janeiro, I Don't Want to Miss a Thing, Aerosmith, https://open.spotify.com/track/6Z3fsQfKc6c2qzXZ5Z5Z5Z
1999, Fevereiro, ...Baby One More Time, Britney Spears, https://open.spotify.com/track/6Z3fsQfKc6c2qzXZ5Z5Z5Z
1999, Março, ...Baby One More Time, Britney Spears, https://open.spotify.com/track/6Z3fsQfKc6c2qzXZ5Z5Z5Z
1999, Abril, No Scrubs, TLC, https://open.spotify.com/track/6Z3fsQfKc6c2qzXZ5Z5Z5Z
1999, Maio, Livin' la Vida Loca, Ricky Martin, https://open.spotify.com/track/6Z3fsQfKc6c2qzXZ5Z5Z5Z
1999, Junho, Livin' la Vida Loca, Ricky Martin, https://open.spotify.com/track/6Z3fsQfKc6c2qzXZ5Z5Z5Z
1999, Julho, If You Had My Love, Jennifer Lopez, https://open.spotify.com/track/6Z3fsQfKc6c2qzXZ5Z5Z5Z
1999, Agosto, Genie in a Bottle, Christina Aguilera, https://open.spotify.com/track/6Z3fsQfKc6c2qzXZ5Z5Z5Z
1999, Setembro, Genie in a Bottle, Christina Aguilera, https://open.spotify.com/track/6Z3fsQfKc6c2qzXZ5Z5Z5Z
1999, Outubro, Smooth, Santana featuring Rob Thomas, https://open.spotify.com/track/6Z3fsQfKc6c2qzXZ5Z5Z5Z
1999, Novembro, Smooth, Santana featuring Rob Thomas, https://open.spotify.com/track/6Z3fsQfKc6c2qzXZ5Z5Z5Z
1999, Dezembro, Smooth, Santana featuring Rob Thomas, https://open.spotify.com/track/6Z3fsQfKc6c2qzXZ5Z5Z5Z
2000, Janeiro, Smooth, Santana featuring Rob Thomas, https://open.spotify.com/track/6Z3fsQfKc6c2qzXZ5Z5Z5Z
2000, Fevereiro, Thank God I Found You, Mariah Carey featuring Joe & 98 Degrees, https://open.spotify.com/track/6Z3fsQfKc6c2qzXZ5Z5Z5Z
2000, Março, Amazed, Lonestar, https://open.spotify.com/track/6Z3fsQfKc6c2qzXZ5Z5Z5Z
2000, Abril, Say My Name, Destiny's Child, https://open.spotify.com/track/6Z3fsQfKc6c2qzXZ5Z5Z5Z
2000, Maio, Maria Maria, Santana featuring The Product G&B, https://open.spotify.com/track/6Z3fsQfKc6c2qzXZ5Z5Z5Z
2000, Junho, Try Again, Aaliyah, https://open.spotify.com/track/6Z3fsQfKc6c2qzXZ5Z5Z5Z
2000, Julho, Be with You, Enrique Iglesias, https://open.spotify.com/track/6Z3fsQfKc6c2qzXZ5Z5Z5Z
2000, Agosto, It's Gonna Be Me, *NSYNC, https://open.spotify.com/track/6Z3fsQfKc6c2qzXZ5Z5Z5Z
2000, Setembro, Music, Madonna, https://open.spotify.com/track/6Z3fsQfKc6c2qzXZ5Z5Z5Z
2000, Outubro, Come On Over Baby (All I Want Is You), Christina Aguilera, https://open.spotify.com/track/6Z3fsQfKc6c2qzXZ5Z5Z5Z
2000, Novembro, Independent Women Part I, Destiny's Child, https://open.spotify.com/track/6Z3fsQfKc6c2qzXZ5Z5Z5Z
2000, Dezembro, Independent Women Part I, Destiny's Child, https://open.spotify.com/track/6Z3fsQfKc6c2qzXZ5Z5Z5Z
2001, Janeiro, Independent Women Part I, Destiny's Child, https://open.spotify.com/track/6Z3fsQfKc6c2qzXZ5Z5Z5Z
2001, Fevereiro, It Wasn't Me, Shaggy featuring Rikrok, https://open.spotify.com/track/6Z3fsQfKc6c2qzXZ5Z5Z5Z
2001, Março, Stutter, Joe featuring Mystikal, https://open.spotify.com/track/6Z3fsQfKc6c2qzXZ5Z5Z5Z
2001, Abril, Butterfly, Crazy Town, https://open.spotify.com/track/6Z3fsQfKc6c2qzXZ5Z5Z5Z
2001, Maio, All for You, Janet Jackson, https://open.spotify.com/track/6Z3fsQfKc6c2qzXZ5Z5Z5Z
"2001, Junho, Lady Marmalade, Christina Aguilera;  Lil' Kim; Mýa & Pink, https://open.spotify.com/track/6Z3fsQfKc6c2qzXZ5Z5Z5Z"
2001, Julho, U Remind Me, Usher, https://open.spotify.com/track/6Z3fsQfKc6c2qzXZ5Z5Z5Z
