2001, Agosto, Bootylicious, Destiny's Child, https://open.spotify.com/track/6Z3fsQfKc6c2qzXZ5Z5Z5Z
2001, Setembro, Fallin', Alicia Keys, https://open.spotify.com/track/6Z3fsQfKc6c2qzXZ5Z5Z5Z
2001, Outubro, I'm Real, Jennifer Lopez featuring Ja Rule, https://open.spotify.com/track/6Z3fsQfKc6c2qzXZ5Z5Z5Z
2001, Novembro, Family Affair, Mary J. Blige, https://open.spotify.com/track/6Z3fsQfKc6c2qzXZ5Z5Z5Z
2001, Dezembro, How You Remind Me, Nickelback, https://open.spotify.com/track/6Z3fsQfKc6c2qzXZ5Z5Z5Z
2002, Janeiro, How You Remind Me, Nickelback, https://open.spotify.com/track/6Z3fsQfKc6c2qzXZ5Z5Z5Z
2002, Fevereiro, Always on Time, Ja Rule featuring Ashanti, https://open.spotify.com/track/6Z3fsQfKc6c2qzXZ5Z5Z5Z
2002, Março, Ain't It Funny, Jennifer Lopez featuring Ja Rule, https://open.spotify.com/track/6Z3fsQfKc6c2qzXZ5Z5Z5Z
2002, Abril, Foolish, Ashanti, https://open.spotify.com/track/6Z3fsQfKc6c2qzXZ5Z5Z5Z
2002, Maio, Foolish, Ashanti, https://open.spotify.com/track/6Z3fsQfKc6c2qzXZ5Z5Z5Z
2002, Junho, Hot in Herre, Nelly, https://open.spotify.com/track/6Z3fsQfKc6c2qzXZ5Z5Z5Z
2002, Julho, Dilemma, Nelly featuring Kelly Rowland, https://open.spotify.com/track/6Z3fsQfKc6c2qzXZ5Z5Z5Z
2002, Agosto, Dilemma, Nelly featuring Kelly Rowland, https://open.spotify.com/track/6Z3fsQfKc6c2qzXZ5Z5Z5Z
2002, Setembro, A Moment Like This, Kelly Clarkson, https://open.spotify.com/track/6Z3fsQfKc6c2qzXZ5Z5Z5Z
2002, Outubro, Lose Yourself, Eminem, https://open.spotify.com/track/6Z3fsQfKc6c2qzXZ5Z5Z5Z
2002, Novembro, Lose Yourself, Eminem, https://open.spotify.com/track/6Z3fsQfKc6c2qzXZ5Z5Z5Z
2002, Dezembro, Lose Yourself, Eminem, https://open.spotify.com/track/6Z3fsQfKc6c2qzXZ5Z5Z5Z
2003, Janeiro, Lose Yourself, Eminem, https://open.spotify.com/track/6Z3fsQfKc6c2qzXZ5Z5Z5Z
2003, Fevereiro, Bump Bump Bump, B2K featuring P. Diddy, https://open.spotify.com/track/6Z3fsQfKc6c2qzXZ5Z5Z5Z
2003, Março, In da Club, 50 Cent, https://open.spotify.com/track/6Z3fsQfKc6c2qzXZ5Z5Z5Z
2003, Abril, Get Busy, Sean Paul, https://open.spotify.com/track/6Z3fsQfKc6c2qzXZ5Z5Z5Z
2003, Maio, Get Busy, Sean Paul, https://open.spotify.com/track/6Z3fsQfKc6c2qzXZ5Z5Z5Z
2003, Junho, 21 Questions, 50 Cent featuring Nate Dogg, https://open.spotify.com/track/6Z3fsQfKc6c2qzXZ5Z5Z5Z
2003, Julho, Crazy in Love, Beyoncé featuring Jay-Z, https://open.spotify.com/track/6Z3fsQfKc6c2qzXZ5Z5Z5Z
2003, Agosto, Crazy in Love, Beyoncé featuring Jay-Z, https://open.spotify.com/track/6Z3fsQfKc6c2qzXZ5Z5Z5Z
"2003, Setembro, Shake Ya Tailfeather, Nelly; P. Diddy & Murphy Lee, https://open.spotify.com/track/6Z3fsQfKc6c2qzXZ5Z5Z5Z"
2003, Outubro, Baby Boy, Beyoncé featuring Sean Paul, https://open.spotify.com/track/6Z3fsQfKc6c2qzXZ5Z5Z5Z
2003, Novembro, Baby Boy, Beyoncé featuring Sean Paul, https://open.spotify.com/track/6Z3fsQfKc6c2qzXZ5Z5Z5Z
2003, Dezembro, Hey Ya!, OutKast, https://open.spotify.com/track/6Z3fsQfKc6c2qzXZ5Z5Z5Z
2004, Janeiro, Hey Ya!, OutKast, https://open.spotify.com/track/6Z3fsQfKc6c2qzXZ5Z5Z5Z
2004, Fevereiro, The Way You Move, OutKast featuring Sleepy Brown, https://open.spotify.com/track/6Z3fsQfKc6c2qzXZ5Z5Z5Z
2004, Março, Slow Jamz, Twista featuring Kanye West & Jamie Foxx, https://open.spotify.com/track/6Z3fsQfKc6c2qzXZ5Z5Z5Z
2004, Abril, Yeah!, Usher featuring Lil Jon & Ludacris, https://open.spotify.com/track/6Z3fsQfKc6c2qzXZ5Z5Z5Z
2004, Maio, Burn, Usher, https://open.spotify.com/track/6Z3fsQfKc6c2qzXZ5Z5Z5Z
2004, Junho, Burn, Usher, https://open.spotify.com/track/6Z3fsQfKc6c2qzXZ5Z5Z5Z
2004, Julho, Confessions Part II, Usher, https://open.spotify.com/track/6Z3fsQfKc6c2qzXZ5Z5Z5Z
2004, Agosto, Confessions Part II, Usher, https://open.spotify.com/track/6Z3fsQfKc6c2qzXZ5Z5Z5Z
2004, Setembro, Goodies, Ciara featuring Petey Pablo, https://open.spotify.com/track/6Z3fsQfKc6c2qzXZ5Z5Z5Z
2004, Outubro, Goodies, Ciara featuring Petey Pablo, https://open.spotify.com/track/6Z3fsQfKc6c2qzXZ5Z5Z5Z
2004, Novembro, My Boo, Usher & Alicia Keys, https://open.spotify.com/track/6Z3fsQfKc6c2qzXZ5Z5Z5Z
2004, Dezembro, Drop It Like It's Hot, Snoop Dogg featuring Pharrell, https://open.spotify.com/track/6Z3fsQfKc6c2qzXZ5Z5Z5Z
2005, Janeiro, Drop It Like It's Hot, Snoop Dogg featuring Pharrell, https://open.spotify.com/track/6Z3fsQfKc6c2qzXZ5Z5Z5Z
2005, Fevereiro, Candy Shop, 50 Cent featuring Olivia, https://open.spotify.com/track/6Z3fsQfKc6c2qzXZ5Z5Z5Z
2005, Março, Candy Shop, 50 Cent featuring Olivia, https://open.spotify.com/track/6Z3fsQfKc6c2qzXZ5Z5Z5Z
2005, Abril, Hollaback Girl, Gwen Stefani, https://open.spotify.com/track/6Z3fsQfKc6c2qzXZ5Z5Z5Z
2005, Maio, Hollaback Girl, Gwen Stefani, https://open.spotify.com/track/6Z3fsQfKc6c2qzXZ5Z5Z5Z
2005, Junho, We Belong Together, Mariah Carey, https://open.spotify.com/track/6Z3fsQfKc6c2qzXZ5Z5Z5Z
2005, Julho, We Belong Together, Mariah Carey, https://open.spotify.com/track/6Z3fsQfKc6c2qzXZ5Z5Z5Z
2005, Agosto, We Belong Together, Mariah Carey, https://open.spotify.com/track/6Z3fsQfKc6c2qzXZ5Z5Z5Z
2005, Setembro, We Belong Together, Mariah Carey, https://open.spotify.com/track/6Z3fsQfKc6c2qzXZ5Z5Z5Z
2005, Outubro, Gold Digger, Kanye West featuring Jamie Foxx, https://open.spotify.com/track/6Z3fsQfKc6c2qzXZ5Z5Z5Z
2005, Novembro, Gold Digger, Kanye West featuring Jamie Foxx, https://open.spotify.com/track/6Z3fsQfKc6c2qzXZ5Z5Z5Z
2005, Dezembro, Run It!, Chris Brown, https://open.spotify.com/track/6Z3fsQfKc6c2qzXZ5Z5Z5Z
2006, Janeiro, Run It!, Chris Brown, https://open.spotify.com/track/6Z3fsQfKc6c2qzXZ5Z5Z5Z
2006, Fevereiro, Check on It, Beyoncé featuring Slim Thug, https://open.spotify.com/track/6Z3fsQfKc6c2qzXZ5Z5Z5Z
2006, Março, Check on It, Beyoncé featuring Slim Thug, https://open.spotify.com/track/6Z3fsQfKc6c2qzXZ5Z5Z5Z
2006, Abril, Bad Day, Daniel Powter, https://open.spotify.com/track/6Z3fsQfKc6c2qzXZ5Z5Z5Z
2006, Maio, SOS, Rihanna, https://open.spotify.com/track/6Z3fsQfKc6c2qzXZ5Z5Z5Z
2006, Junho, Hips Don't Lie, Shakira featuring Wyclef Jean, https://open.spotify.com/track/6Z3fsQfKc6c2qzXZ5Z5Z5Z
2006, Julho, Hips Don't Lie, Shakira featuring Wyclef Jean, https://open.spotify.com/track/6Z3fsQfKc6c2qzXZ5Z5Z5Z
2006, Agosto, Promiscuous, Nelly Furtado featuring Timbaland, https://open.spotify.com/track/6Z3fsQfKc6c2qzXZ5Z5Z5Z
2006, Setembro, SexyBack, Justin Timberlake, https://open.spotify.com/track/6Z3fsQfKc6c2qzXZ5Z5Z5Z
2006, Outubro, SexyBack, Justin Timberlake, https://open.spotify.com/track/6Z3fsQfKc6c2qzXZ5Z5Z5Z
2006, Novembro, My Love, Justin Timberlake featuring T.I., https://open.spotify.com/track/6Z3fsQfKc6c2qzXZ5Z5Z5Z
2006, Dezembro, Irreplaceable, Beyoncé, https://open.spotify.com/track/6Z3fsQfKc6c2qzXZ5Z5Z5Z
2007, Janeiro, Irreplaceable, Beyoncé, https://open.spotify.com/track/6Z3fsQfKc6c2qzXZ5Z5Z5Z
2007, Fevereiro, Irreplaceable, Beyoncé, https://open.spotify.com/track/6Z3fsQfKc6c2qzXZ5Z5Z5Z
2007, Março, What Goes Around... Comes Around, Justin Timberlake, https://open.spotify.com/track/6Z3fsQfKc6c2qzXZ5Z5Z5Z
2007, Abril, Give It to Me, Timbaland featuring Nelly Furtado & Justin Timberlake, https://open.spotify.com/track/6Z3fsQfKc6c2qzXZ5Z5Z5Z
2007, Maio, Buy U a Drank (Shawty Snappin'), T-Pain featuring Yung Joc, https://open.spotify.com/track/6Z3fsQfKc6c2qzXZ5Z5Z5Z
2007, Junho, Umbrella, Rihanna featuring Jay-Z, https://open.spotify.com/track/6Z3fsQfKc6c2qzXZ5Z5Z5Z
2007, Julho, Umbrella, Rihanna featuring Jay-Z, https://open.spotify.com/track/6Z3fsQfKc6c2qzXZ5Z5Z5Z
2007, Agosto, Beautiful Girls, Sean Kingston, https://open.spotify.com/track/6Z3fsQfKc6c2qzXZ5Z5Z5Z
2007, Setembro, Crank That (Soulja Boy), Soulja Boy Tell 'Em, https://open.spotify.com/track/6Z3fsQfKc6c2qzXZ5Z5Z5Z
2007, Outubro, Crank That (Soulja Boy), Soulja Boy Tell 'Em, https://open.spotify.com/track/6Z3fsQfKc6c2qzXZ5Z5Z5Z
2007, Novembro, Kiss Kiss, Chris Brown featuring T-Pain, https://open.spotify.com/track/6Z3fsQfKc6c2qzXZ5Z5Z5Z
2007, Dezembro, Low, Flo Rida featuring T-Pain, https://open.spotify.com/track/6Z3fsQfKc6c2qzXZ5Z5Z5Z
2008, Janeiro, Low, Flo Rida featuring T-Pain, https://open.spotify.com/track/6Z3fsQfKc6c2qzXZ5Z5Z5Z
2008, Fevereiro, Low, Flo Rida featuring T-Pain, https://open.spotify.com/track/6Z3fsQfKc6c2qzXZ5Z5Z5Z
2008, Março, Love in This Club, Usher featuring Young Jeezy, https://open.spotify.com/track/6Z3fsQfKc6c2qzXZ5Z5Z5Z
2008, Abril, Bleeding Love, Leona Lewis, https://open.spotify.com/track/6Z3fsQfKc6c2qzXZ5Z5Z5Z
2008, Maio, Lollipop, Lil Wayne featuring Static Major, https://open.spotify.com/track/6Z3fsQfKc6c2qzXZ5Z5Z5Z
2008, Junho, Take a Bow, Rihanna, https://open.spotify.com/track/6Z3fsQfKc6c2qzXZ5Z5Z5Z
2008, Julho, I Kissed a Girl, Katy Perry, https://open.spotify.com/track/6Z3fsQfKc6c2qzXZ5Z5Z5Z
2008, Agosto, Disturbia, Rihanna, https://open.spotify.com/track/6Z3fsQfKc6c2qzXZ5Z5Z5Z
2008, Setembro, Whatever You Like, T.I., https://open.spotify.com/track/6Z3fsQfKc6c2qzXZ5Z5Z5Z
2008, Outubro, Live Your Life, T.I. featuring Rihanna, https://open.spotify.com/track/6Z3fsQfKc6c2qzXZ5Z5Z5Z
2008, Novembro, Live Your Life, T.I. featuring Rihanna, https://open.spotify.com/track/6Z3fsQfKc6c2qzXZ5Z5Z5Z
2008, Dezembro, Single Ladies (Put a Ring on It), Beyoncé, https://open.spotify.com/track/6Z3fsQfKc6c2qzXZ5Z5Z5Z
2009, Janeiro, Single Ladies (Put a Ring on It), Beyoncé, https://open.spotify.com/track/6Z3fsQfKc6c2qzXZ5Z5Z5Z
2009, Fevereiro, Just Dance, Lady Gaga featuring Colby O'Donis, https://open.spotify.com/track/6Z3fsQfKc6c2qzXZ5Z5Z5Z
2009, Março, Right Round, Flo Rida featuring Ke$ha, https://open.spotify.com/track/6Z3fsQfKc6c2qzXZ5Z5Z5Z
2009, Abril, Boom Boom Pow, The Black Eyed Peas, https://open.spotify.com/track/6Z3fsQfKc6c2qzXZ5Z5Z5Z
2009, Maio, Boom Boom Pow, The Black Eyed Peas, https://open.spotify.com/track/6Z3fsQfKc6c2qzXZ5Z5Z5Z
2009, Junho, I Gotta Feeling, The Black Eyed Peas, https://open.spotify.com/track/6Z3fsQfKc6c2qzXZ5Z5Z5Z
2009, Julho, I Gotta Feeling, The Black Eyed Peas, https://open.spotify.com/track/6Z3fsQfKc6c2qzXZ5Z5Z5Z
2009, Agosto, I Gotta Feeling, The Black Eyed Peas, https://open.spotify.com/track/6Z3fsQfKc6c2qzXZ5Z5Z5Z
2009, Setembro, I Gotta Feeling, The Black Eyed Peas, https://open.spotify.com/track/6Z3fsQfKc6c2qzXZ5Z5Z5Z
2009, Outubro, Down, Jay Sean featuring Lil Wayne, https://open.spotify.com/track/6Z3fsQfKc6c2qzXZ5Z5Z5Z
2009, Novembro, Fireflies, Owl City, https://open.spotify.com/track/6Z3fsQfKc6c2qzXZ5Z5Z5Z
2009, Dezembro, Tik Tok, Ke$ha, https://open.spotify.com/track/6Z3fsQfKc6c2qzXZ5Z5Z5Z
2010, Janeiro, Tik Tok, Ke$ha, https://open.spotify.com/track/6Z3fsQfKc6c2qzXZ5Z5Z5Z
2010, Fevereiro, Tik Tok, Ke$ha, https://open.spotify.com/track/6Z3fsQfKc6c2qzXZ5Z5Z5Z
2010, Março, Imma Be, The Black Eyed Peas, https://open.spotify.com/track/6Z3fsQfKc6c2qzXZ5Z5Z5Z
2010, Abril, Rude Boy, Rihanna, https://open.spotify.com/track/6Z3fsQfKc6c2qzXZ5Z5Z5Z
2010, Maio, Nothin' on You, B.o.B featuring Bruno Mars, https://open.spotify.com/track/6Z3fsQfKc6c2qzXZ5Z5Z5Z
2010, Junho, OMG, Usher featuring will.i.am, https://open.spotify.com/track/6Z3fsQfKc6c2qzXZ5Z5Z5Z
2010, Julho, California Gurls, Katy Perry featuring Snoop Dogg, https://open.spotify.com/track/6Z3fsQfKc6c2qzXZ5Z5Z5Z
2010, Agosto, Love the Way You Lie, Eminem featuring Rihanna, https://open.spotify.com/track/6Z3fsQfKc6c2qzXZ5Z5Z5Z
2010, Setembro, Teenage Dream, Katy Perry, https://open.spotify.com/track/6Z3fsQfKc6c2qzXZ5Z5Z5Z
2010, Outubro, Just the Way You Are, Bruno Mars, https://open.spotify.com/track/6Z3fsQfKc6c2qzXZ5Z5Z5Z
2010, Novembro, Like a G6, Far East Movement featuring The Cataracs & Dev, https://open.spotify.com/track/6Z3fsQfKc6c2qzXZ5Z5Z5Z
2010, Dezembro, Firework, Katy Perry, https://open.spotify.com/track/6Z3fsQfKc6c2qzXZ5Z5Z5Z
2011, Janeiro, Grenade, Bruno Mars, https://open.spotify.com/track/6Z3fsQfKc6c2qzXZ5Z5Z5Z
2011, Fevereiro, Black and Yellow, Wiz Khalifa, https://open.spotify.com/track/6Z3fsQfKc6c2qzXZ5Z5Z5Z
2011, Março, Born This Way, Lady Gaga, https://open.spotify.com/track/6Z3fsQfKc6c2qzXZ5Z5Z5Z
2011, Abril, E.T., Katy Perry featuring Kanye West, https://open.spotify.com/track/6Z3fsQfKc6c2qzXZ5Z5Z5Z
2011, Maio, S&M, Rihanna, https://open.spotify.com/track/6Z3fsQfKc6c2qzXZ5Z5Z5Z
2011, Junho, Rolling in the Deep, Adele, https://open.spotify.com/track/6Z3fsQfKc6c2qzXZ5Z5Z5Z
2011, Julho, Party Rock Anthem, LMFAO featuring Lauren Bennett & GoonRock, https://open.spotify.com/track/6Z3fsQfKc6c2qzXZ5Z5Z5Z
2011, Agosto, Call Me Maybe, Carly Rae Jepsen, https://open.spotify.com/track/6Z3fsQfKc6c2qzXZ5Z5Z5Z
2011, Setembro, Call Me Maybe, Carly Rae Jepsen, https://open.spotify.com/track/6Z3fsQfKc6c2qzXZ5Z5Z5Z
2011, Outubro, We Found Love, Rihanna featuring Calvin Harris, https://open.spotify.com/track/6Z3fsQfKc6c2qzXZ5Z5Z5Z
2011, Novembro, We Found Love, Rihanna featuring Calvin Harris, https://open.spotify.com/track/6Z3fsQfKc6c2qzXZ5Z5Z5Z
2011, Dezembro, We Found Love, Rihanna featuring Calvin Harris, https://open.spotify.com/track/6Z3fsQfKc6c2qzXZ5Z5Z5Z
2012, Janeiro, We Found Love, Rihanna featuring Calvin Harris, https://open.spotify.com/track/6Z3fsQfKc6c2qzXZ5Z5Z5Z
2012, Fevereiro, Set Fire to the Rain, Adele, https://open.spotify.com/track/6Z3fsQfKc6c2qzXZ5Z5Z5Z
2012, Março, Stronger (What Doesn't Kill You), Kelly Clarkson, https://open.spotify.com/track/6Z3fsQfKc6c2qzXZ5Z5Z5Z
2012, Abril, We Are Young, fun. featuring Janelle Monáe, https://open.spotify.com/track/6Z3fsQfKc6c2qzXZ5Z5Z5Z
2012, Maio, Somebody That I Used to Know, Gotye featuring Kimbra, https://open.spotify.com/track/6Z3fsQfKc6c2qzXZ5Z5Z5Z
2012, Junho, Call Me Maybe, Carly Rae Jepsen, https://open.spotify.com/track/6Z3fsQfKc6c2qzXZ5Z5Z5Z
2012, Julho, Call Me Maybe, Carly Rae Jepsen, https://open.spotify.com/track/6Z3fsQfKc6c2qzXZ5Z5Z5Z
2012, Agosto, Whistle, Flo Rida, https://open.spotify.com/track/6Z3fsQfKc6c2qzXZ5Z5Z5Z
2012, Setembro, We Are Never Ever Getting Back Together, Taylor Swift, https://open.spotify.com/track/6Z3fsQfKc6c2qzXZ5Z5Z5Z
2012, Outubro, One More Night, Maroon 5, https://open.spotify.com/track/6Z3fsQfKc6c2qzXZ5Z5Z5Z
2012, Novembro, Diamonds, Rihanna, https://open.spotify.com/track/6Z3fsQfKc6c2qzXZ5Z5Z5Z
2012, Dezembro, Locked Out of Heaven, Bruno Mars, https://open.spotify.com/track/6Z3fsQfKc6c2qzXZ5Z5Z5Z
2013, Janeiro, Locked Out of Heaven, Bruno Mars, https://open.spotify.com/track/6Z3fsQfKc6c2qzXZ5Z5Z5Z
2013, Fevereiro, Thrift Shop, Macklemore & Ryan Lewis featuring Wanz, https://open.spotify.com/track/6Z3fsQfKc6c2qzXZ5Z5Z5Z
2013, Março, Harlem Shake, Baauer, https://open.spotify.com/track/6Z3fsQfKc6c2qzXZ5Z5Z5Z
2013, Abril, Thrift Shop, Macklemore & Ryan Lewis featuring Wanz, https://open.spotify.com/track/6Z3fsQfKc6c2qzXZ5Z5Z5Z
2013, Maio, Can't Hold Us, Macklemore & Ryan Lewis featuring Ray Dalton, https://open.spotify.com/track/6Z3fsQfKc6c2qzXZ5Z5Z5Z
2013, Junho, Blurred Lines, Robin Thicke featuring T.I. & Pharrell, https://open.spotify.com/track/6Z3fsQfKc6c2qzXZ5Z5Z5Z
2013, Julho, Blurred Lines, Robin Thicke featuring T.I. & Pharrell, https://open.spotify.com/track/6Z3fsQfKc6c2qzXZ5Z5Z5Z
2013, Agosto, Blurred Lines, Robin Thicke featuring T.I. & Pharrell, https://open.spotify.com/track/6Z3fsQfKc6c2qzXZ5Z5Z5Z
2013, Setembro, Roar, Katy Perry, https://open.spotify.com/track/6Z3fsQfKc6c2qzXZ5Z5Z5Z
2013, Outubro, Wrecking Ball, Miley Cyrus, https://open.spotify.com/track/6Z3fsQfKc6c2qzXZ5Z5Z5Z
2013, Novembro, Royals, Lorde, https://open.spotify.com/track/6Z3fsQfKc6c2qzXZ5Z5Z5Z
2013, Dezembro, Royals, Lorde, https://open.spotify.com/track/6Z3fsQfKc6c2qzXZ5Z5Z5Z
2014, Janeiro, The Monster, Eminem featuring Rihanna, https://open.spotify.com/track/6Z3fsQfKc6c2qzXZ5Z5Z5Z
2014, Fevereiro, Dark Horse, Katy Perry featuring Juicy J, https://open.spotify.com/track/6Z3fsQfKc6c2qzXZ5Z5Z5Z
2014, Março, Happy, Pharrell Williams, https://open.spotify.com/track/6Z3fsQfKc6c2qzXZ5Z5Z5Z
2014, Abril, Happy, Pharrell Williams, https://open.spotify.com/track/6Z3fsQfKc6c2qzXZ5Z5Z5Z
2014, Maio, All of Me, John Legend, https://open.spotify.com/track/6Z3fsQfKc6c2qzXZ5Z5Z5Z
2014, Junho, Fancy, Iggy Azalea featuring Charli XCX, https://open.spotify.com/track/6Z3fsQfKc6c2qzXZ5Z5Z5Z
2014, Julho, Fancy, Iggy Azalea featuring Charli XCX, https://open.spotify.com/track/6Z3fsQfKc6c2qzXZ5Z5Z5Z
2014, Agosto, Shake It Off, Taylor Swift, https://open.spotify.com/track/6Z3fsQfKc6c2qzXZ5Z5Z5Z
2014, Setembro, Shake It Off, Taylor Swift, https://open.spotify.com/track/6Z3fsQfKc6c2qzXZ5Z5Z5Z
2014, Outubro, All About That Bass, Meghan Trainor, https://open.spotify.com/track/6Z3fsQfKc6c2qzXZ5Z5Z5Z
2014, Novembro, Blank Space, Taylor Swift, https://open.spotify.com/track/6Z3fsQfKc6c2qzXZ5Z5Z5Z
2014, Dezembro, Blank Space, Taylor Swift, https://open.spotify.com/track/6Z3fsQfKc6c2qzXZ5Z5Z5Z
2015, Janeiro, Uptown Funk!, Mark Ronson featuring Bruno Mars, https://open.spotify.com/track/6Z3fsQfKc6c2qzXZ5Z5Z5Z
2015, Fevereiro, Uptown Funk!, Mark Ronson featuring Bruno Mars, https://open.spotify.com/track/6Z3fsQfKc6c2qzXZ5Z5Z5Z
2015, Março, Uptown Funk!, Mark Ronson featuring Bruno Mars, https://open.spotify.com/track/6Z3fsQfKc6c2qzXZ5Z5Z5Z
2015, Abril, Uptown Funk!, Mark Ronson featuring Bruno Mars, https://open.spotify.com/track/6Z3fsQfKc6c2qzXZ5Z5Z5Z
2015, Maio, See You Again, Wiz Khalifa featuring Charlie Puth, https://open.spotify.com/track/6Z3fsQfKc6c2qzXZ5Z5Z5Z
2015, Junho, Bad Blood, Taylor Swift featuring Kendrick Lamar, https://open.spotify.com/track/6Z3fsQfKc6c2qzXZ5Z5Z5Z
2015, Julho, Cheerleader, OMI, https://open.spotify.com/track/6Z3fsQfKc6c2qzXZ5Z5Z5Z
2015, Agosto, Can't Feel My Face, The Weeknd, https://open.spotify.com/track/6Z3fsQfKc6c2qzXZ5Z5Z5Z
2015, Setembro, What Do You Mean?, Justin Bieber, https://open.spotify.com/track/6Z3fsQfKc6c2qzXZ5Z5Z5Z
2015, Outubro, The Hills, The Weeknd, https://open.spotify.com/track/6Z3fsQfKc6c2qzXZ5Z5Z5Z
2015, Novembro, Hello, Adele, https://open.spotify.com/track/6Z3fsQfKc6c2qzXZ5Z5Z5Z
2015, Dezembro, Hello, Adele, https://open.spotify.com/track/6Z3fsQfKc6c2qzXZ5Z5Z5Z
2016, Janeiro, Hello, Adele, https://open.spotify.com/track/6Z3fsQfKc6c2qzXZ5Z5Z5Z
2016, Fevereiro, Love Yourself, Justin Bieber, https://open.spotify.com/track/6Z3fsQfKc6c2qzXZ5Z5Z5Z
2016, Março, Work, Rihanna featuring Drake, https://open.spotify.com/track/6Z3fsQfKc6c2qzXZ5Z5Z5Z
2016, Abril, Work, Rihanna featuring Drake, https://open.spotify.com/track/6Z3fsQfKc6c2qzXZ5Z5Z5Z
2016, Maio, Panda, Desiigner, https://open.spotify.com/track/6Z3fsQfKc6c2qzXZ5Z5Z5Z
2016, Junho, One Dance, Drake featuring WizKid & Kyla, https://open.spotify.com/track/6Z3fsQfKc6c2qzXZ5Z5Z5Z
2016, Julho, One Dance, Drake featuring WizKid & Kyla, https://open.spotify.com/track/6Z3fsQfKc6c2qzXZ5Z5Z5Z
2016, Agosto, One Dance, Drake featuring WizKid & Kyla, https://open.spotify.com/track/6Z3fsQfKc6c2qzXZ5Z5Z5Z
2016, Setembro, Closer, The Chainsmokers featuring Halsey, https://open.spotify.com/track/6Z3fsQfKc6c2qzXZ5Z5Z5Z
2016, Outubro, Closer, The Chainsmokers featuring Halsey, https://open.spotify.com/track/6Z3fsQfKc6c2qzXZ5Z5Z5Z
2016, Novembro, Closer, The Chainsmokers featuring Halsey, https://open.spotify.com/track/6Z3fsQfKc6c2qzXZ5Z5Z5Z
2016, Dezembro, Starboy, The Weeknd featuring Daft Punk, https://open.spotify.com/track/6Z3fsQfKc6c2qzXZ5Z5Z5Z
2017, Janeiro, Bad and Boujee, Migos featuring Lil Uzi Vert, https://open.spotify.com/track/6Z3fsQfKc6c2qzXZ5Z5Z5Z
2017, Fevereiro, Shape of You, Ed Sheeran, https://open.spotify.com/track/6Z3fsQfKc6c2qzXZ5Z5Z5Z
2017, Março, Shape of You, Ed Sheeran, https://open.spotify.com/track/6Z3fsQfKc6c2qzXZ5Z5Z5Z
2017, Abril, Shape of You, Ed Sheeran, https://open.spotify.com/track/6Z3fsQfKc6c2qzXZ5Z5Z5Z
2017, Maio, Humble, Kendrick Lamar, https://open.spotify.com/track/6Z3fsQfKc6c2qzXZ5Z5Z5Z
2017, Junho, Despacito, Luis Fonsi & Daddy Yankee featuring Justin Bieber, https://open.spotify.com/track/6Z3fsQfKc6c2qzXZ5Z5Z5Z
2017, Julho, Despacito, Luis Fonsi & Daddy Yankee featuring Justin Bieber, https://open.spotify.com/track/6Z3fsQfKc6c2qzXZ5Z5Z5Z
2017, Agosto, Despacito, Luis Fonsi & Daddy Yankee featuring Justin Bieber, https://open.spotify.com/track/6Z3fsQfKc6c2qzXZ5Z5Z5Z
2017, Setembro, Look What You Made Me Do, Taylor Swift, https://open.spotify.com/track/6Z3fsQfKc6c2qzXZ5Z5Z5Z
2017, Outubro, Bodak Yellow, Cardi B, https://open.spotify.com/track/6Z3fsQfKc6c2qzXZ5Z5Z5Z
2017, Novembro, Rockstar, Post Malone featuring 21 Savage, https://open.spotify.com/track/6Z3fsQfKc6c2qzXZ5Z5Z5Z
2017, Dezembro, Rockstar, Post Malone featuring 21 Savage, https://open.spotify.com/track/6Z3fsQfKc6c2qzXZ5Z5Z5Z
2018, Janeiro, Perfect, Ed Sheeran, https://open.spotify.com/track/6Z3fsQfKc6c2qzXZ5Z5Z5Z
2018, Fevereiro, God's Plan, Drake, https://open.spotify.com/track/6Z3fsQfKc6c2qzXZ5Z5Z5Z
2018, Março, God's Plan, Drake, https://open.spotify.com/track/6Z3fsQfKc6c2qzXZ5Z5Z5Z
2018, Abril, God's Plan, Drake, https://open.spotify.com/track/6Z3fsQfKc6c2qzXZ5Z5Z5Z
2018, Maio, Nice for What, Drake, https://open.spotify.com/track/6Z3fsQfKc6c2qzXZ5Z5Z5Z
2018, Junho, Nice for What, Drake, https://open.spotify.com/track/6Z3fsQfKc6c2qzXZ5Z5Z5Z
2018, Julho, In My Feelings, Drake, https://open.spotify.com/track/6Z3fsQfKc6c2qzXZ5Z5Z5Z
2018, Agosto, In My Feelings, Drake, https://open.spotify.com/track/6Z3fsQfKc6c2qzXZ5Z5Z5Z
2018, Setembro, In My Feelings, Drake, https://open.spotify.com/track/6Z3fsQfKc6c2qzXZ5Z5Z5Z
2018, Outubro, Girls Like You, Maroon 5 featuring Cardi B, https://open.spotify.com/track/6Z3fsQfKc6c2qzXZ5Z5Z5Z
2018, Novembro, Thank U Next, Ariana Grande, https://open.spotify.com/track/6Z3fsQfKc6c2qzXZ5Z5Z5Z
2018, Dezembro, Thank U Next, Ariana Grande, https://open.spotify.com/track/6Z3fsQfKc6c2qzXZ5Z5Z5Z
2019, Janeiro, Sunflower, Post Malone & Swae Lee, https://open.spotify.com/track/6Z3fsQfKc6c2qzXZ5Z5Z5Z
2019, Fevereiro, 7 Rings, Ariana Grande, https://open.spotify.com/track/6Z3fsQfKc6c2qzXZ5Z5Z5Z
2019, Março, 7 Rings, Ariana Grande, https://open.spotify.com/track/6Z3fsQfKc6c2qzXZ5Z5Z5Z
2019, Abril, Old Town Road, Lil Nas X featuring Billy Ray Cyrus, https://open.spotify.com/track/6Z3fsQfKc6c2qzXZ5Z5Z5Z
2019, Maio, Old Town Road, Lil Nas X featuring Billy Ray Cyrus, https://open.spotify.com/track/6Z3fsQfKc6c2qzXZ5Z5Z5Z
2019, Junho, Old Town Road, Lil Nas X featuring Billy Ray Cyrus, https://open.spotify.com/track/6Z3fsQfKc6c2qzXZ5Z5Z5Z
2019, Julho, Old Town Road, Lil Nas X featuring Billy Ray Cyrus, https://open.spotify.com/track/6Z3fsQfKc6c2qzXZ5Z5Z5Z
2019, Agosto, Old Town Road, Lil Nas X featuring Billy Ray Cyrus, https://open.spotify.com/track/6Z3fsQfKc6c2qzXZ5Z5Z5Z
2019, Setembro, Truth Hurts, Lizzo, https://open.spotify.com/track/6Z3fsQfKc6c2qzXZ5Z5Z5Z
2019, Outubro, Truth Hurts, Lizzo, https://open.spotify.com/track/6Z3fsQfKc6c2qzXZ5Z5Z5Z
2019, Novembro, Someone You Loved, Lewis Capaldi, https://open.spotify.com/track/6Z3fsQfKc6c2qzXZ5Z5Z5Z
2019, Dezembro, Circles, Post Malone, https://open.spotify.com/track/6Z3fsQfKc6c2qzXZ5Z5Z5Z
2020, Janeiro, The Box, Roddy Ricch, https://open.spotify.com/track/6Z3fsQfKc6c2qzXZ5Z5Z5Z
2020, Fevereiro, The Box, Roddy Ricch, https://open.spotify.com/track/6Z3fsQfKc6c2qzXZ5Z5Z5Z
2020, Março, The Box, Roddy Ricch, https://open.spotify.com/track/6Z3fsQfKc6c2qzXZ5Z5Z5Z
2020, Abril, Blinding Lights, The Weeknd, https://open.spotify.com/track/6Z3fsQfKc6c2qzXZ5Z5Z5Z
2020, Maio, Blinding Lights, The Weeknd, https://open.spotify.com/track/6Z3fsQfKc6c2qzXZ5Z5Z5Z
2020, Junho, Rockstar, DaBaby featuring Roddy Ricch, https://open.spotify.com/track/6Z3fsQfKc6c2qzXZ5Z5Z5Z
2020, Julho, Rockstar, DaBaby featuring Roddy Ricch, https://open.spotify.com/track/6Z3fsQfKc6c2qzXZ5Z5Z5Z
2020, Agosto, Cardigan, Taylor Swift, https://open.spotify.com/track/6Z3fsQfKc6c2qzXZ5Z5Z5Z
2020, Setembro, WAP, Cardi B featuring Megan Thee Stallion, https://open.spotify.com/track/6Z3fsQfKc6c2qzXZ5Z5Z5Z
2020, Outubro, WAP, Cardi B featuring Megan Thee Stallion, https://open.spotify.com/track/6Z3fsQfKc6c2qzXZ5Z5Z5Z
2020, Novembro, Mood, 24kGoldn featuring Iann Dior, https://open.spotify.com/track/6Z3fsQfKc6c2qzXZ5Z5Z5Z
2020, Dezembro, Mood, 24kGoldn featuring Iann Dior, https://open.spotify.com/track/6Z3fsQfKc6c2qzXZ5Z5Z5Z
2021, Janeiro, Mood, 24kGoldn featuring Iann Dior, https://open.spotify.com/track/6Z3fsQfKc6c2qzXZ5Z5Z5Z
2021, Fevereiro, Drivers License, Olivia Rodrigo, https://open.spotify.com/track/6Z3fsQfKc6c2qzXZ5Z5Z5Z
2021, Março, Drivers License, Olivia Rodrigo, https://open.spotify.com/track/6Z3fsQfKc6c2qzXZ5Z5Z5Z
2021, Abril, Peaches, Justin Bieber featuring Daniel Caesar & Giveon, https://open.spotify.com/track/6Z3fsQfKc6c2qzXZ5Z5Z5Z
2021, Maio, Levitating, Dua Lipa featuring DaBaby, https://open.spotify.com/track/6Z3fsQfKc6c2qzXZ5Z5Z5Z
2021, Junho, Good 4 U, Olivia Rodrigo, https://open.spotify.com/track/6Z3fsQfKc6c2qzXZ5Z5Z5Z
2021, Julho, Butter, BTS, https://open.spotify.com/track/6Z3fsQfKc6c2qzXZ5Z5Z5Z
2021, Agosto, Stay, The Kid LAROI & Justin Bieber, https://open.spotify.com/track/6Z3fsQfKc6c2qzXZ5Z5Z5Z
2021, Setembro, Stay, The Kid LAROI & Justin Bieber, https://open.spotify.com/track/6Z3fsQfKc6c2qzXZ5Z5Z5Z
2021, Outubro, Stay, The Kid LAROI & Justin Bieber, https://open.spotify.com/track/6Z3fsQfKc6c2qzXZ5Z5Z5Z
2021, Novembro, All Too Well (Taylor's Version), Taylor Swift, https://open.spotify.com/track/6Z3fsQfKc6c2qzXZ5Z5Z5Z
2021, Dezembro, All I Want for Christmas Is You, Mariah Carey, https://open.spotify.com/track/6Z3fsQfKc6c2qzXZ5Z5Z5Z
2022, Janeiro, We Don't Talk About Bruno, Encanto Cast, https://open.spotify.com/track/6Z3fsQfKc6c2qzXZ5Z5Z5Z
2022, Fevereiro, We Don't Talk About Bruno, Encanto Cast, https://open.spotify.com/track/6Z3fsQfKc6c2qzXZ5Z5Z5Z
2022, Março, Heat Waves, Glass Animals, https://open.spotify.com/track/6Z3fsQfKc6c2qzXZ5Z5Z5Z
2022, Abril, As It Was, Harry Styles, https://open.spotify.com/track/6Z3fsQfKc6c2qzXZ5Z5Z5Z
2022, Maio, As It Was, Harry Styles, https://open.spotify.com/track/6Z3fsQfKc6c2qzXZ5Z5Z5Z
2022, Junho, As It Was, Harry Styles, https://open.spotify.com/track/6Z3fsQfKc6c2qzXZ5Z5Z5Z
